title,date_published,news_outlet,article_link,summary,text,Sentiment_Score
YMAG: Weekly Income That's Worth The Risk,2025-05-21 07:53:52,SeekingAlpha,https://finnhub.io/api/news?id=a54d20461d49b996f23bbf8e806a40327d1ad57d3f58c40f8cee9a2e9f59f27d,"YMAG uses a synthetic options strategy on Mag 7 stocks, trading upside for high, tax-efficient distributions. Read why I maintain a buy rating on YMAG ETF.","YMAG uses a synthetic options strategy on Mag 7 stocks, trading upside for high, tax-efficient distributions. Read why I maintain a buy rating on YMAG ETF.",0.9196984581649303
Warby Parker Stock Pops on Partnership With Google to Develop AI Glasses,2025-05-21 02:53:12,Yahoo,https://finnhub.io/api/news?id=eb4280e28fe838f79c49b3d5a91d039fa222a81cf09d7bf66041bc6584ca6fb7,"Warby Parker is working with Google to develop glasses that will rival an offering from Meta Platforms.  Google said at its keynote on Tuesday that Warby Parker was one of two companies that ""will be the first eyewear partners to build glasses with Android XR.""  Warby Parker said in a news release on Tuesday that it is partnering with Google to develop AI-powered glasses ""intended for all-day wear.""","Warby Parker is working with Google to develop glasses that will rival an offering from Meta Platforms.  Google said at its keynote on Tuesday that Warby Parker was one of two companies that ""will be the first eyewear partners to build glasses with Android XR.""  Warby Parker said in a news release on Tuesday that it is partnering with Google to develop AI-powered glasses ""intended for all-day wear.""",0.43776553869247437
"Google announces smart glasses partnerships as it takes on Meta, Apple preps its own eyewear",2025-05-21 01:45:42,Yahoo,https://finnhub.io/api/news?id=456e69b89d61aa141d2b8ddeb6cab0860e577b19f36b5497a3851f2b22ae7cf1,Google says its working with Warby Parker and Gentle Monster on AR smart glasses.,Google says its working with Warby Parker and Gentle Monster on AR smart glasses.,0.6477718353271484
"Apple Under-Owned, Meta Platforms (META) Over-Owned—Morgan Stanley Stays Bullish on Both",2025-05-21 01:33:51,Yahoo,https://finnhub.io/api/news?id=252882a17887106b89a78abdddb4f63b23501f49c86674402dcfea593605dec6,"We recently published a list of 11 AI Stocks On Wall Street’s Radar. In this article, we are going to take a look at where Meta Platforms, Inc. (NASDAQ:META) stands against other AI stocks on Wall Street’s radar. US President Donald Trump is all set to revive the country’s struggling coal industry. Last month, he […]","We recently published a list of 11 AI Stocks On Wall Street’s Radar. In this article, we are going to take a look at where Meta Platforms, Inc. (NASDAQ:META) stands against other AI stocks on Wall Street’s radar. US President Donald Trump is all set to revive the country’s struggling coal industry. Last month, he […]",0.8742470517754555
Meta Platforms (META) to the Moon? Loop Capital Set an $888 Price Target!,2025-05-21 01:31:02,Yahoo,https://finnhub.io/api/news?id=7c8fae876252c442ee0afe3f07c9ea0d1cc22519e413a4c77286e0035b483b64,"Loop Capital analyst Rob Sanderson recently raised the price target on Meta Platforms, Inc. (NASDAQ:META) to $888 from $695 and keeps a Buy rating on the shares. Meta engages in the development of products that enable people to connect and share with friends and family. The analyst cited the company’s better than expected 2Q outlook […]","Loop Capital analyst Rob Sanderson recently raised the price target on Meta Platforms, Inc. (NASDAQ:META) to $888 from $695 and keeps a Buy rating on the shares. Meta engages in the development of products that enable people to connect and share with friends and family. The analyst cited the company’s better than expected 2Q outlook […]",0.06800718419253826
Warby Parker partners with Google as they take on Meta with AI-powered glasses,2025-05-21 00:21:00,MarketWatch,https://finnhub.io/api/news?id=ef9da85889207176e95733e6f6356e96c2859fa90a5dc71c370740e63892867d,Warby Parker partners with Google as they take on Meta with AI-powered glasses,Warby Parker partners with Google as they take on Meta with AI-powered glasses,0.9492120575159788
Janus Henderson Forty Fund Q1 2025 Commentary,2025-05-21 00:15:00,SeekingAlpha,https://finnhub.io/api/news?id=4e3385abeb5a134ea512c831a93c9a651f051f8304f316c22b169cee35a9bf77,Janus Henderson Forty Fund returned -8.74% and the Russell 1000Â® Growth Index returned -9.97%. Read more here.,Janus Henderson Forty Fund returned -8.74% and the Russell 1000Â® Growth Index returned -9.97%. Read more here.,0.8979548253118992
Do You Really Understand Huawei's Threat To Nvidia? (Rating Downgrade),2025-05-21 00:01:57,SeekingAlpha,https://finnhub.io/api/news?id=86d7e17284f7d1648c2885cdc1b51f34c3633873dfc49a37bd541db54199b08d,Huawei's GPU advancements & U.S.-China trade tensions could impact Nvidia Corporation's Q1 FY 2026 outlook. Click here to find out why NVDA stock is a Hold.,Huawei's GPU advancements & U.S.-China trade tensions could impact Nvidia Corporation's Q1 FY 2026 outlook. Click here to find out why NVDA stock is a Hold.,0.6468880102038383
Prominent Investor Is Bullish on META Stock,2025-05-20 22:50:23,Yahoo,https://finnhub.io/api/news?id=123d15417f1d421802a867e9672f57d94904219b56bbfad31daf3f9838cafb79,"Meta Platforms Inc (META) is “making huge inroads” in the advertising market, and META stock is “cheap,” well-known investor Bryn Talkington recently asserted on CNBC. A frequent guest on CNBC, Talkington is a Managing Partner of Requisite Capital Management. Meta Platforms Inc (META) Continues to Make Progress in the Ad Market, Talkington Says “Instagram continues […]","Meta Platforms Inc (META) is “making huge inroads” in the advertising market, and META stock is “cheap,” well-known investor Bryn Talkington recently asserted on CNBC. A frequent guest on CNBC, Talkington is a Managing Partner of Requisite Capital Management. Meta Platforms Inc (META) Continues to Make Progress in the Ad Market, Talkington Says “Instagram continues […]",0.3883875906467438
"Tesla's Texas Plan B if Delaware won’t reinstate Elon Musk's pay. It's not about the money, says Elon.",2025-05-20 22:35:00,Yahoo,https://finnhub.io/api/news?id=741f7cfe8f0ad6c806c1b34a83e3b561e4a0b82219c615fe310365ad49bdd14f,"Texas to the rescue? Tesla is exploring alternative ways to pay its CEO, Elon Musk, in a new deal that, if approved, would be the first time the EV maker’s pay proposal for the world’s richest man would be subject to Texas rather than Delaware law.","Texas to the rescue? Tesla is exploring alternative ways to pay its CEO, Elon Musk, in a new deal that, if approved, would be the first time the EV maker’s pay proposal for the world’s richest man would be subject to Texas rather than Delaware law.",0.8474332690238953
Alphabet Traders Look to Developer Event to Shift AI Narrative,2025-05-20 21:35:03,Yahoo,https://finnhub.io/api/news?id=bd1b8cc05c3d7d0f5739494c8f5c0817c408a22d856b9afe95b8ac73ddda66ef,"(Bloomberg) -- Alphabet Inc.’s investors are looking to this week’s developer conference to see if the company can reset the narrative amid fears that its long-standing market dominance is on shaky ground.Most Read from BloombergAmerica, ‘Nation of Porches’NJ Transit Train Engineers Strike, Disrupting Travel to NYCNJ Transit Makes Deal With Engineers, Ending Three-Day StrikeThe Google I/O event, which begins Tuesday, is expected to showcase the company’s latest advancements in artificial intelli","(Bloomberg) -- Alphabet Inc.’s investors are looking to this week’s developer conference to see if the company can reset the narrative amid fears that its long-standing market dominance is on shaky ground.Most Read from BloombergAmerica, ‘Nation of Porches’NJ Transit Train Engineers Strike, Disrupting Travel to NYCNJ Transit Makes Deal With Engineers, Ending Three-Day StrikeThe Google I/O event, which begins Tuesday, is expected to showcase the company’s latest advancements in artificial intelli",0.5801764754578471
XLG: Build Your Portfolio With The Best 50 Stocks,2025-05-20 20:58:41,SeekingAlpha,https://finnhub.io/api/news?id=7d8354c7dc5619af5c3a098eb9fd382fd0c54cc9906dc2569eda769aa04dae77,"Discover why the Invesco S&P 500 Top 50 ETF (XLG) is a strong buy with sector-leading stocks, outperformance, a low 0.2% expense ratio, and long-term growth.","Discover why the Invesco S&P 500 Top 50 ETF (XLG) is a strong buy with sector-leading stocks, outperformance, a low 0.2% expense ratio, and long-term growth.",0.1747094988822937
Meet the 10 CFOs on Fortune’s 2025 Most Powerful Women in business list,2025-05-20 20:04:33,Yahoo,https://finnhub.io/api/news?id=df1a023d5e011f3c73aefe975379a661eafcde4cda3071ce75ca82dfa2a1b761,"The list features 100 leading businesswomen from finance, tech, health care, telecom, retail, energy, and other industries.","The list features 100 leading businesswomen from finance, tech, health care, telecom, retail, energy, and other industries.",0.9169241860508919
Tariff-Driven Dollar Woes Help Brighten First-Quarter Earnings,2025-05-20 20:00:00,Yahoo,https://finnhub.io/api/news?id=be5762e94995a93f581ef53fe649117041668eb320f0ce05ed933bcc1ef1867d,"(Bloomberg) -- Tariffs unexpectedly devaluing the US dollar — and in turn boosting corporate earnings — was one of the few bright spots of the first-quarter earnings season in North America. Most Read from BloombergAmerica, ‘Nation of Porches’NJ Transit Train Engineers Strike, Disrupting Travel to NYCNJ Transit Makes Deal With Engineers, Ending Three-Day StrikeContrary to what analysts and executives had expected at the beginning of the year, a Bloomberg gauge of the dollar has collapsed in rece","(Bloomberg) -- Tariffs unexpectedly devaluing the US dollar — and in turn boosting corporate earnings — was one of the few bright spots of the first-quarter earnings season in North America. Most Read from BloombergAmerica, ‘Nation of Porches’NJ Transit Train Engineers Strike, Disrupting Travel to NYCNJ Transit Makes Deal With Engineers, Ending Three-Day StrikeContrary to what analysts and executives had expected at the beginning of the year, a Bloomberg gauge of the dollar has collapsed in rece",0.5060874996706843
Crypto scores a victory as GENIUS Act stablecoin legislation stays alive in Senate,2025-05-20 19:45:38,Yahoo,https://finnhub.io/api/news?id=e304c8dc98c910366936d217552b1c2d9c632d3cddab4da3f30ab4f5e44dbed2,"A bill to regulate stablecoins passed a key procedural hurdle in the Senate Monday night, paving a path for final passage of legislation pushed by the crypto industry.","A bill to regulate stablecoins passed a key procedural hurdle in the Senate Monday night, paving a path for final passage of legislation pushed by the crypto industry.",0.1806037425994873
Crypto scores a victory as stablecoin legislation stays alive in Senate,2025-05-20 19:45:38,Yahoo,https://finnhub.io/api/news?id=c7b8c2b9540f9bad467cd405aac89aff4a6cdb05b580bb080e8c0a3f05aaaccc,"A bill to regulate stablecoins passed a key procedural hurdle in the Senate Monday night, paving a path for final passage of legislation pushed by the crypto industry.","A bill to regulate stablecoins passed a key procedural hurdle in the Senate Monday night, paving a path for final passage of legislation pushed by the crypto industry.",0.1660684570670128
3 Unstoppable Tech Stocks to Buy Hand Over Fist,2025-05-20 19:45:00,Yahoo,https://finnhub.io/api/news?id=21faa3c8c23f7442165d39608f32f49867542a0740642c744fd82829339f11e4,"Tech stocks have been the market’s primary growth driver for nearly two straight decades.  Growth stocks have dramatically outperformed most asset classes over the past two decades.  Within that universe, large-cap tech leaders have delivered the lion's share of returns, riding tailwinds from the invention of the internet, cloud computing, and artificial intelligence (AI).","Tech stocks have been the market’s primary growth driver for nearly two straight decades.  Growth stocks have dramatically outperformed most asset classes over the past two decades.  Within that universe, large-cap tech leaders have delivered the lion's share of returns, riding tailwinds from the invention of the internet, cloud computing, and artificial intelligence (AI).",0.15320594608783722
Janus Henderson Global Sustainable Equity Fund Q1 2025 Commentary,2025-05-20 19:10:00,SeekingAlpha,https://finnhub.io/api/news?id=663483b8f318225c40b35ab6882a2deaea3a2b8325c7a41ed13f1a278b30388a,,,0.9528472684323788
2 Top Artificial Intelligence (AI) Stocks to Buy No Matter What Happens With Tariffs,2025-05-20 18:45:00,Yahoo,https://finnhub.io/api/news?id=88eb768873db34a557aca2815209e3d8a41c78b60dc4bc462390ba90917ab138,"Meta Platforms has several long-term trends playing in its favor.  Nvidia's GPUs are starting to be produced in the U.S.  Artificial intelligence (AI) investing is somewhat affected by tariffs, as tariffs may be placed on components coming into the U.S. In addition, broader consumer demand may harm some of the cash flows that are being poured into AI investments.","Meta Platforms has several long-term trends playing in its favor.  Nvidia's GPUs are starting to be produced in the U.S.  Artificial intelligence (AI) investing is somewhat affected by tariffs, as tariffs may be placed on components coming into the U.S. In addition, broader consumer demand may harm some of the cash flows that are being poured into AI investments.",0.5110810827463865
Janus Henderson Global Sustainable Equity (ADR) Managed Account Q1 2025 Commentary,2025-05-20 18:22:00,SeekingAlpha,https://finnhub.io/api/news?id=3be7a11dd30e1997481e45a99512ee5e63913c751fc02bceadf5eff4a61ff7a6,The Portfolio returned 1.05% (gross) and the MSCI World Gross TR returned -1.68%.,The Portfolio returned 1.05% (gross) and the MSCI World Gross TR returned -1.68%.,0.7705928981304169
Why Buy The Azure Effect: Update From The Microsoft Build Conference,2025-05-20 18:13:04,SeekingAlpha,https://finnhub.io/api/news?id=7a29579732eecf72d4969799f0eb3b045840fe7dbaf70a6810c962320f0bd4c3,"Discover why Microsoft Corporation's cloud innovations, Azure growth, and strategic investments make it a solid pick for growth. Click for more on MSFT stock.","Discover why Microsoft Corporation's cloud innovations, Azure growth, and strategic investments make it a solid pick for growth. Click for more on MSFT stock.",0.6845998764038086
Janus Henderson Global Research Fund Q1 2025 Commentary,2025-05-20 17:33:00,SeekingAlpha,https://finnhub.io/api/news?id=51ac3412915715ffec0d9343fe811d79c4b7adbd26e693fb357112384995a3e6,The Fund returned -1.49% and the MSCI World Index returned -1.79%.,The Fund returned -1.49% and the MSCI World Index returned -1.79%.,0.463598370552063
TQQQ Has Been Beaten Down Enough (Rating Upgrade),2025-05-20 17:17:56,SeekingAlpha,https://finnhub.io/api/news?id=87919dfa8a1bd1a1c0169f42ae6f2eea92a8ae73ca44954f4daec930ea2eb3ad,TQQQ ETF has also taken a beating this year as US markets plunge from its steep valuations. See how TQQQ recent performance justifies a rating upgrade from bearish to hold.,TQQQ ETF has also taken a beating this year as US markets plunge from its steep valuations. See how TQQQ recent performance justifies a rating upgrade from bearish to hold.,0.4640773870050907
The AI Diffusion Rule is Over. What That Means for Trump and China.,2025-05-20 17:17:00,MarketWatch,https://finnhub.io/api/news?id=db56fefbc318f5e4eb185ab5279d323ea85397e2c4c64ab031fee4a1bb57cf08,The AI Diffusion Rule is Over. What That Means for Trump and China.,The AI Diffusion Rule is Over. What That Means for Trump and China.,0.9234695769846439
Janus Henderson Concentrated Growth Managed Account Q1 2025 Commentary,2025-05-20 12:02:00,SeekingAlpha,https://finnhub.io/api/news?id=13db9baffbad752497e26abb265d55760635e8994fb267a1d930788e56a2616a,,,0.8755892068147659
"Dow Jones Futures: Amazon, Broadcom, Meta, Palantir In Or Near Buy Zones",2025-05-20 10:21:38,Yahoo,https://finnhub.io/api/news?id=e0279dee06de69faea854ae6d108accbc6ce0cef37b7f803b2dc10e5b664319f,"Dow Jones Futures: Amazon, Broadcom, Meta and Palantir stock are among the best stocks to buy and watch today.","Dow Jones Futures: Amazon, Broadcom, Meta and Palantir stock are among the best stocks to buy and watch today.",0.7912144660949707
Janus Henderson Concentrated All Cap Growth Managed Account Q1 2025 Commentary,2025-05-20 08:44:00,SeekingAlpha,https://finnhub.io/api/news?id=6f1e131948f469cef9c45e50cad0f27f5dbb52242baaf17597d284cc50c1b989,Concentrated All Cap Growth Managed Account returned -9.25% (gross) and the Russell 3000Â® Growth Index returned -10.05%. Read more here.,Concentrated All Cap Growth Managed Account returned -9.25% (gross) and the Russell 3000Â® Growth Index returned -10.05%. Read more here.,0.9316862616688013
Tracking David Tepper's Appaloosa Management Portfolio - Q1 2025 Update,2025-05-20 06:54:42,SeekingAlpha,https://finnhub.io/api/news?id=571b5fd48a654bb868cb2b6d859320d89d5a354aa0d0e9a754415714558138ad,"Appaloosaâs Q1 2025 portfolio value surged to $8.38B, with 39 holdings. Check out the major new bets and significant stake increases here.","Appaloosaâs Q1 2025 portfolio value surged to $8.38B, with 39 holdings. Check out the major new bets and significant stake increases here.",0.3219318389892578
"Alphabet: Things Aren't Looking Good, But At Least It's Cheap",2025-05-20 06:15:55,SeekingAlpha,https://finnhub.io/api/news?id=fc723d645409c4073fc25d4b7b2f3eb4986785a2484c21ced82ffd617e0651e6,Alphabet faces further headwinds as de minimis exemptions increase costs for customers. Read why GOOGL stock is upgraded to Hold.,Alphabet faces further headwinds as de minimis exemptions increase costs for customers. Read why GOOGL stock is upgraded to Hold.,0.5020073652267456
Meta Shares Usage Insights in FTC Trial,2025-05-20 01:27:45,Yahoo,https://finnhub.io/api/news?id=d9de1852067aacc7cb757706eb8c3176936f215168cc389e1d9c52d35e264aab,Some key insights into evolving social media trends.,Some key insights into evolving social media trends.,0.8369728401303291
Tech stocks took a hit after the last two U.S. credit downgrades. Why this time could be different.,2025-05-20 01:14:00,MarketWatch,https://finnhub.io/api/news?id=4e273e7ca1bddc705d0718fbf20f17525ac049fe2709bf139e3fb5c5c4b47a91,Tech stocks took a hit after the last two U.S. credit downgrades. Why this time could be different.,Tech stocks took a hit after the last two U.S. credit downgrades. Why this time could be different.,0.8478028662502766
Meta Will Soon Enable Advertisers to Test Experimental AI Features,2025-05-20 00:49:42,Yahoo,https://finnhub.io/api/news?id=e013103b779deb8180afc68d6fc108389173b55afedfd856558464ebb23f2da0,Meta's launching a new program that will enable advertisers to try out its evolving AI ad tools.,Meta's launching a new program that will enable advertisers to try out its evolving AI ad tools.,0.40371087193489075
Netflix stock downgraded on valuation concerns despite recent defensive strength,2025-05-19 23:50:33,Yahoo,https://finnhub.io/api/news?id=5a02becd7c0820880e13dd11cef4ac53c38cf965ffc4d33850fedee0e2815594,"Netflix's high valuation is a key reason for the downgrade, according to JPMorgan.","Netflix's high valuation is a key reason for the downgrade, according to JPMorgan.",0.5101707489229739
Hartford Large Cap Growth ETF Q1 2025 Commentary,2025-05-19 23:43:00,SeekingAlpha,https://finnhub.io/api/news?id=f563a3b9a9ce763c03eb924355c9365044cd53d0090f29fd4aae82ba75cfff2f,The Hartford Large Cap Growth ETF underperformed the Russell 1000 Growth Index during the quarter. Read more here.,The Hartford Large Cap Growth ETF underperformed the Russell 1000 Growth Index during the quarter. Read more here.,0.6746157333254814
"Apple remains under-owned vs. peers, Meta still over-held - Morgan Stanley",2025-05-19 21:50:07,Yahoo,https://finnhub.io/api/news?id=c8580d82cc628355c1d01339ee930d0c0a3a6275fc35b247358d1ea9e53aa456,"Investing.com -- Apple remains the most under-owned mega-cap tech stock among large institutions, while Meta (NASDAQ:META) continues to be over-held, according to Morgan Stanley’s latest analysis of first-quarter 13-F filings.","Investing.com -- Apple remains the most under-owned mega-cap tech stock among large institutions, while Meta (NASDAQ:META) continues to be over-held, according to Morgan Stanley’s latest analysis of first-quarter 13-F filings.",0.554355894215405
Janus Henderson Global Technology and Innovation Fund Q1 2025 Commentary,2025-05-19 20:10:00,SeekingAlpha,https://finnhub.io/api/news?id=e09e926f54227f8c5a36b381ed0c27689fc89fc10391265be4caedbdc9b9acbf,The Fund returned -10.18% and the S&P 500Â®Index returned -4.27%. The MSCI All Country World Information Technology Index SM returned -11.64%.,The Fund returned -10.18% and the S&P 500Â®Index returned -4.27%. The MSCI All Country World Information Technology Index SM returned -11.64%.,0.6450507491827011
This could be another market surprise after the Moody's US credit rating downgrade,2025-05-19 20:09:56,Yahoo,https://finnhub.io/api/news?id=c7b64b811d22ca3cafa36f1d3e94a2ddc61081b15b69c36064775fc26e24a11c,Why this veteran forecaster is worried about the outlook for corporate profits.,Why this veteran forecaster is worried about the outlook for corporate profits.,0.7031187564134598
"Dow Jones Futures Fall, Yields Jump On U.S. Debt Rating Downgrade; Broadcom, Meta Eye Buy Points",2025-05-19 20:08:18,Yahoo,https://finnhub.io/api/news?id=5a35e50da4bcc51a4e913ffb63409801a4e292c7abc3bca6884da2101134ccbb,"The stock market has entered a power trend, but Moody's cut the U.S. debt rating late Friday. Meta, Broadcom lead stocks setting up.","The stock market has entered a power trend, but Moody's cut the U.S. debt rating late Friday. Meta, Broadcom lead stocks setting up.",0.484711654484272
Wall Street Lunch: Nvidia's Huang Previews Next-Gen Tech,2025-05-19 19:59:00,SeekingAlpha,https://finnhub.io/api/news?id=fe759bd3e10bfd81ec9eea2a4b6bdfbf04c21a394a10b488234a4e8c2675f510,Nvidia (NVDA) CEO Jensen Huang announced a wave of new technologies and partnerships at the Computex 2025 conference in Taiwan to reinforce the companyâs dominance in AI computing space.,Nvidia (NVDA) CEO Jensen Huang announced a wave of new technologies and partnerships at the Computex 2025 conference in Taiwan to reinforce the companyâs dominance in AI computing space.,0.17480111867189407
2 Artificial Intelligence Stocks You Can Buy and Hold for the Next Decade,2025-05-19 19:30:00,Yahoo,https://finnhub.io/api/news?id=3252f4aed119d480fb847a130c29eb97adca2b3fd75fab629d931f79ed40f2ea,Meta Platforms is making huge investments in several real-world AI devices.  Taiwan Semiconductor is behind many of today's cutting-edge technologies.  Meta Platforms (NASDAQ: META) and Taiwan Semiconductor Manufacturing (NYSE: TSM) are the two stocks that meet this criteria.,Meta Platforms is making huge investments in several real-world AI devices.  Taiwan Semiconductor is behind many of today's cutting-edge technologies.  Meta Platforms (NASDAQ: META) and Taiwan Semiconductor Manufacturing (NYSE: TSM) are the two stocks that meet this criteria.,0.8462926000356674
Meta: One Of The Most Attractive Mag-7 Stocks,2025-05-19 19:13:18,SeekingAlpha,https://finnhub.io/api/news?id=29fa47cccae542c81cd9afcfee9938278d01ba23dce01db1f2603c1f5af6cd95,"Meta combines top-tier profitability, strong growth, and AI-driven innovation, trading attractively relative to peers. See why META stock is a strong buy.","Meta combines top-tier profitability, strong growth, and AI-driven innovation, trading attractively relative to peers. See why META stock is a strong buy.",0.19755519926548004
Janus Henderson Balanced Fund Q1 2025 Commentary,2025-05-19 18:46:00,SeekingAlpha,https://finnhub.io/api/news?id=afd2de04e75f146aa407e807b818159d04600d690b1f9426f93ceada4148ab74,The Fund returned -2.05% and the S&P 500Â®Index returned -4.27%. The Bloomberg U.S. Aggregate Bond Index returned 2.78%. The Balanced Index returned -1.45%.,The Fund returned -2.05% and the S&P 500Â®Index returned -4.27%. The Bloomberg U.S. Aggregate Bond Index returned 2.78%. The Balanced Index returned -1.45%.,0.6190711557865143
Stablecoin Bill Set to Pass Senate. What It Means for Crypto.,2025-05-19 17:01:00,MarketWatch,https://finnhub.io/api/news?id=be1ba3fb1ab587ad11b1ad2a5cec5587dfd51410b1df58d2514fde4707f195c2,Stablecoin Bill Set to Pass Senate. What It Means for Crypto.,Stablecoin Bill Set to Pass Senate. What It Means for Crypto.,0.9533842317759991
2 Profitable Stocks with Promising Prospects and 1 to Steer Clear Of,2025-05-19 12:39:04,Yahoo,https://finnhub.io/api/news?id=76ffb6eced4b7febb996588d6ca13f7595ad9fa78694e1ab5b06bda7346f37d8,Not all profitable companies are built to last - some rely on outdated models or unsustainable advantages. Just because a business is in the green today doesn’t mean it will thrive tomorrow.,Not all profitable companies are built to last - some rely on outdated models or unsustainable advantages. Just because a business is in the green today doesn’t mean it will thrive tomorrow.,0.8562951162457466
FLQL: Multi-Factor Vs. Single Factors,2025-05-19 11:25:14,SeekingAlpha,https://finnhub.io/api/news?id=49378a38da8b32d672f3bafed22ed31f182419f9216d3277db29ec935e7a0d2d,"FLQL implements a strategy combining quality, value and momentum factors in the Russell 1000. Read why FLQL ETF is a Hold.","FLQL implements a strategy combining quality, value and momentum factors in the Russell 1000. Read why FLQL ETF is a Hold.",0.9088247865438461
