title,date_published,news_outlet,article_link,summary,text,Sentiment_Score
Meta: Early Warning Signs Of Excessive Capex Spends Like In 2022,2025-05-27 19:30:57,SeekingAlpha,https://finnhub.io/api/news?id=23687e519729750d973d73f8c3ea30b1388541d4aa3b34a8b169ad0b99d620aa,"Explore why Meta's slowing revenue growth, aggressive capex, and uncertain ROI are raising concerns for investors. Click here to read my most recent analysis.","Explore why Meta's slowing revenue growth, aggressive capex, and uncertain ROI are raising concerns for investors. Click here to read my most recent analysis.",0.552610176615417
Nvidia Has A Demand Problem,2025-05-27 19:17:36,SeekingAlpha,https://finnhub.io/api/news?id=3968e8ab8ee06adbf6d7d01cc5b84a79527533574b8260ac2d4a7fb9c0287b1f,"Nvidia Corporation's Q1 FY 2026 earnings are highly anticipated, but the company's demand outlook is troubling. Click here to find out why NVDA stock is a Sell.","Nvidia Corporation's Q1 FY 2026 earnings are highly anticipated, but the company's demand outlook is troubling. Click here to find out why NVDA stock is a Sell.",0.5128508750349283
"If You Have Any Doubts Over Tesla's Ambitions in Artificial Intelligence (AI), This 1 Word From Nvidia CEO Jensen Huang Should Change Your Mind",2025-05-27 19:00:00,Yahoo,https://finnhub.io/api/news?id=e6a986bdd568bc8904946a458118f426d4bb28ecd6b409cd237265a646e66d9a,"Tesla has lofty ambitions when it comes to artificial intelligence (AI), but the technology isn't transforming the company just yet.","Tesla has lofty ambitions when it comes to artificial intelligence (AI), but the technology isn't transforming the company just yet.",0.8749468103051186
Dow Jones Jumps 400 Points On Trump Tariff News; Nvidia Stock Eyes New Buy Point,2025-05-27 17:47:40,DowJones,https://finnhub.io/api/news?id=68763a83c8bdb532029c45a9dc72caeec51c493c81f6e1c9f15ab3b64aa5e223,Dow Jones Jumps 400 Points On Trump Tariff News; Nvidia Stock Eyes New Buy Point,Dow Jones Jumps 400 Points On Trump Tariff News; Nvidia Stock Eyes New Buy Point,0.7197944819927216
"Billionaire Ole Andreas Halvorsen Just Bought Nvidia, Tesla, and Meta Platforms, but Dumped His Entire Stake in the Cheapest ""Magnificent Seven"" Stock",2025-05-27 15:06:00,Yahoo,https://finnhub.io/api/news?id=f06373ad83da693bd0d1955b04c13cd56e8ec68060f80cd41b74fc798bb89226,Viking Global Investors' billionaire chief sold the most fundamentally attractive member of the Magnificent Seven in favor of a trio of foundational artificial intelligence (AI) stocks.,Viking Global Investors' billionaire chief sold the most fundamentally attractive member of the Magnificent Seven in favor of a trio of foundational artificial intelligence (AI) stocks.,0.9345178920775652
Reddit: High-Growth Company With An Undeniable Moat,2025-05-27 14:59:43,SeekingAlpha,https://finnhub.io/api/news?id=de7a510bd33e35e52f1f22cc53cb5f657a8cb0bdfa52664d4506fc69900d76ba,"Reddit's powerful network effect, vast user-generated content, and strong brand create a durable moat. See why I rate RDDT stock a Buy now.","Reddit's powerful network effect, vast user-generated content, and strong brand create a durable moat. See why I rate RDDT stock a Buy now.",0.553099051117897
What's Zuckerberg Getting From His Shift Toward Trump?,2025-05-27 14:44:25,Yahoo,https://finnhub.io/api/news?id=3f44f05cfee603a340374784ed7ea73f488dd1332689f0176b874ca934df6f9a,"Mark Zuckerberg, the chief executive officer of Meta Platforms Inc., seems to have taken actions to make the company more Trump-friendly. Since November, Zuckerberg has already had a string of postelection get-togethers with Donald Trump and made multiple trips to Mar-a-Lago in Florida. Meta also donated $1 million to the inauguration, and Zuckerberg co-hosted a black-tie reception that evening in Trump's honor. Bloomberg's Charlie Wells discuss this and what this means for Zuckerberg and Meta.","Mark Zuckerberg, the chief executive officer of Meta Platforms Inc., seems to have taken actions to make the company more Trump-friendly. Since November, Zuckerberg has already had a string of postelection get-togethers with Donald Trump and made multiple trips to Mar-a-Lago in Florida. Meta also donated $1 million to the inauguration, and Zuckerberg co-hosted a black-tie reception that evening in Trump's honor. Bloomberg's Charlie Wells discuss this and what this means for Zuckerberg and Meta.",0.8374204337596893
2 Internet Stocks to Research Further and 1 to Ignore,2025-05-27 12:35:37,Yahoo,https://finnhub.io/api/news?id=c8bc59f4764a43075dfd63b54272a6bb5270aa9daaacc5d49864b064f1fdd816,"Whether it be online shopping or social media, secular forces are propelling consumer internet businesses forward. But it’s not all sunshine and rainbows as consumer purchasing power can make or break demand. Unfortunately, the market seems to believe stormy skies are ahead as the industry has shed 2.2% over the past six months. This drop was almost identical to the S&P 500’s decline.","Whether it be online shopping or social media, secular forces are propelling consumer internet businesses forward. But it’s not all sunshine and rainbows as consumer purchasing power can make or break demand. Unfortunately, the market seems to believe stormy skies are ahead as the industry has shed 2.2% over the past six months. This drop was almost identical to the S&P 500’s decline.",0.5014359182678163
"Meta: Attractive And Controversial, Like Always",2025-05-27 10:57:34,SeekingAlpha,https://finnhub.io/api/news?id=902715900548670ebc293d45f02ce653204d6460e1738e4cc2101edeca58c774,"Meta's strong financials, AI ambitions, and growth potential make it a top investment pick, despite antitrust concerns. Read here for an analysis of META stock.","Meta's strong financials, AI ambitions, and growth potential make it a top investment pick, despite antitrust concerns. Read here for an analysis of META stock.",0.8354215696454048
Meta's AI Optionality Advantage: Probability Makes The Stock A No-Brainer,2025-05-27 05:11:57,SeekingAlpha,https://finnhub.io/api/news?id=bf055e3713fefe7290f95775395adada5928ca655f958df55a19aabba6ef5839,"Meta is leveraging AI across advertising, messaging, and content to drive growth. The main risk lies in macroeconomic conditions delaying returns. See more on META here.","Meta is leveraging AI across advertising, messaging, and content to drive growth. The main risk lies in macroeconomic conditions delaying returns. See more on META here.",0.9011474773287773
How Nvidia 'played a central role' in the $306 billion AI startup boom,2025-05-27 03:57:41,Yahoo,https://finnhub.io/api/news?id=c1225b3c929279331e1cccd9ef742c7034399660269a2b257152c518633bdc25,Nvidia's AI chips laid the groundwork for a massive wave of investment in artificial intelligence.,Nvidia's AI chips laid the groundwork for a massive wave of investment in artificial intelligence.,0.8053941130638123
‘Revenge Tax’: US Bill Hits Allies That Have Tax Rules Trump Doesn’t Like,2025-05-26 20:30:00,Yahoo,https://finnhub.io/api/news?id=36a1aa6c255d8e07888a1d8d448ffc7a49c12bf737ba24b96b3c5913cc0375d2,(Bloomberg) -- Supply Lines is a daily newsletter that tracks global trade. Sign up here.Most Read from BloombergNY Private School Pleads for Donors to Stay Open After Declaring BankruptcyUAE’s AI University Aims to Become Stanford of the GulfNYC’s War on Trash Gets a Glam SquadPacific Coast Highway to Reopen Near Malibu After January FiresInvestors in nations with tax regimes that the US deems unfair would face higher tax rates on income earned in the US if the tax bill that’s making its way to,(Bloomberg) -- Supply Lines is a daily newsletter that tracks global trade. Sign up here.Most Read from BloombergNY Private School Pleads for Donors to Stay Open After Declaring BankruptcyUAE’s AI University Aims to Become Stanford of the GulfNYC’s War on Trash Gets a Glam SquadPacific Coast Highway to Reopen Near Malibu After January FiresInvestors in nations with tax regimes that the US deems unfair would face higher tax rates on income earned in the US if the tax bill that’s making its way to,0.6855772286653519
6 charts that capture Nvidia's AI-fueled rise,2025-05-26 18:25:56,Yahoo,https://finnhub.io/api/news?id=345fa0174652aed5aefcac5d4b2f526bc67710a16a50cbc74270b0fdc58e50a7,"With soaring profits and sales, Nvidia's stock has quickly become one of the most influential stocks in the S&P 500 since the launch of ChatGPT.","With soaring profits and sales, Nvidia's stock has quickly become one of the most influential stocks in the S&P 500 since the launch of ChatGPT.",0.08665768802165985
"Pomerantz Law Firm Investigates Claims On Behalf of Investors of Meta Platforms, Inc. - META",2025-05-26 18:01:40,Finnhub,https://finnhub.io/api/news?id=ce54410ac2cfda739f8907b481a7b9380ae08e558fe88814e0d3910fa997b242,"NEW YORK, May 26, 2025 /PRNewswire/ -- Pomerantz LLP is investigating claims on behalf of investors of  Meta Platforms, Inc.  .  Such investors are advised to contact Danielle Peyton at...","NEW YORK, May 26, 2025 /PRNewswire/ -- Pomerantz LLP is investigating claims on behalf of investors of  Meta Platforms, Inc.  .  Such investors are advised to contact Danielle Peyton at...",0.9535479117184877
3 Top Growth Stocks to Buy in the Second Half of 2025,2025-05-26 16:46:00,Yahoo,https://finnhub.io/api/news?id=1c2d7d7a567a5fb51e12b77d6327f3fb28a64c4cac61fe5ce1b3b7ffc5ae895f,"Amazon could hold up better than many expect if steep tariffs remain in place.  Meta Platforms should benefit from multiple AI tailwinds.  Vertex Pharmaceuticals has two new drugs on the market, with more potentially on the way.","Amazon could hold up better than many expect if steep tariffs remain in place.  Meta Platforms should benefit from multiple AI tailwinds.  Vertex Pharmaceuticals has two new drugs on the market, with more potentially on the way.",0.06499273516237736
Market Blinked: Nvidia Looks Undervalued,2025-05-26 15:15:00,SeekingAlpha,https://finnhub.io/api/news?id=7b7ab7bc59a3755f8c138f464c5c73b3facaedf01677bebf5cb4fc4b3df2b608,"Nvidia faces headwinds from China export restrictions and global tariffs, but is actively adapting with modified H20 chips to retain market share. Learn more on NVDA stock here.","Nvidia faces headwinds from China export restrictions and global tariffs, but is actively adapting with modified H20 chips to retain market share. Learn more on NVDA stock here.",0.7581783011555672
"Largest U.S. Pension Sells Apple Stock, Buys Meta, AMD, and McDonald’s",2025-05-26 15:00:00,Yahoo,https://finnhub.io/api/news?id=016e12320962f9604374687e0c663f71f6253b4c0c2681e7f0190cd4365a757d,"The California Public Employees’ Retirement System sold  Apple  stock, and bought more shares of  Meta Platforms Advanced Micro Devices  and  McDonald’s  in the first quarter.  Calpers, as the pension is known, disclosed the stock trades, among others, in a form it filed with the Securities and Exchange Commission.  “Calpers’ public assets investments are index-oriented and optimized using systematic and quantitative investment strategies, not driven by any single period’s events,” Calpers said via email in response to a request for comment.","The California Public Employees’ Retirement System sold  Apple  stock, and bought more shares of  Meta Platforms Advanced Micro Devices  and  McDonald’s  in the first quarter.  Calpers, as the pension is known, disclosed the stock trades, among others, in a form it filed with the Securities and Exchange Commission.  “Calpers’ public assets investments are index-oriented and optimized using systematic and quantitative investment strategies, not driven by any single period’s events,” Calpers said via email in response to a request for comment.",0.9456522781401873
The Next Big Theme: May 2025,2025-05-26 09:45:00,SeekingAlpha,https://finnhub.io/api/news?id=2ec1722c1fd3dd0ca6179f64d76aa2cbe85ffb1b49915bef806400f6abff7bff,Big Tech players will collectively spend over $300 billion on AI-focused infrastructure this year to support the growing demands of AI development.,Big Tech players will collectively spend over $300 billion on AI-focused infrastructure this year to support the growing demands of AI development.,0.2824578434228897
Meta Platforms : Thailand’s Ministry of Digital Economy and Society (MDES) and Personal Data Protection Committee (PDPC) Launch Privacy Education Campaign in Partnership with Meta,2025-05-26 06:06:06,Finnhub,https://finnhub.io/api/news?id=aa0fdf9e6e0905cae7568165284fda7bf80133cc8646458b951225c7874da10a,"Meta Thailand's Ministry of Digital Economy and Society and Personal Data Protection Committee Launch Privacy Education Campaign in Partnership with Meta May 25,...","Meta Thailand's Ministry of Digital Economy and Society and Personal Data Protection Committee Launch Privacy Education Campaign in Partnership with Meta May 25,...",0.8830368369817734
"Nvidia has lost its shock power to investors, for now",2025-05-25 20:30:45,Yahoo,https://finnhub.io/api/news?id=e52fe45d75faaa5f50ef3deaccdb25ab150abf8e0d2e9e243903dc12a96aa1c0,Nvidia's quarter may be tougher than normal to assess. Here's why.,Nvidia's quarter may be tougher than normal to assess. Here's why.,0.625786105170846
Meta Platforms Launches “Llama for Startups” to Boost AI Model Adoption,2025-05-25 18:55:51,Yahoo,https://finnhub.io/api/news?id=d23b15791b09b1b710a8602b7c59fa43e62c821713bb7f00b24c89965578c57c,"On May 21, Meta Platforms Inc. (NASDAQ:META) launched a new initiative called ‘Llama for Startups’ to encourage early-stage companies to adopt its Llama AI models. This program offers direct support from Meta’s Llama team and, in some cases, funding. To be eligible, US-based incorporated firms must have raised less than $10 million in funding, have […]","On May 21, Meta Platforms Inc. (NASDAQ:META) launched a new initiative called ‘Llama for Startups’ to encourage early-stage companies to adopt its Llama AI models. This program offers direct support from Meta’s Llama team and, in some cases, funding. To be eligible, US-based incorporated firms must have raised less than $10 million in funding, have […]",0.3498299568891525
Warning To U.S. Stock Investors Issued By CDS Markets,2025-05-25 17:00:30,SeekingAlpha,https://finnhub.io/api/news?id=f97920368504fbb252852e76238f6338cacf46347dbc312dbd5acf7cd979c889,"US CDS spreads suggest US debt is riskier than official ratings indicate, while equities remain complacent. Learn why the risk-reward in US stocks is poor now.","US CDS spreads suggest US debt is riskier than official ratings indicate, while equities remain complacent. Learn why the risk-reward in US stocks is poor now.",0.6189165152609348
Mark Zuckerberg Once Vented Why Apple AirPods Have No Competition: 'One Of The Protocols That They Used...',2025-05-25 02:01:23,Yahoo,https://finnhub.io/api/news?id=fc7deb4f3dbfef1c1fd55b2c2e449277cb99439eaad4c3a1fc241f3f0a386ae9,"Meta Platforms Inc. (NASDAQ:META) CEO Mark Zuckerberg had once criticized the proprietary AirPods protocol of Apple Inc. (NASDAQ:AAPL), advocating for it to be made accessible to competitors. What Happened: Zuckerberg, on the Joe Rogan Podcast episode 2255, expressed his concerns over Apple’s exclusive AirPods protocol, which provides effortless connectivity with iPhones, claiming it to be an unjust limitation on competitors. Zuckerberg rejected Apple’s assertions of privacy and security risks,","Meta Platforms Inc. (NASDAQ:META) CEO Mark Zuckerberg had once criticized the proprietary AirPods protocol of Apple Inc. (NASDAQ:AAPL), advocating for it to be made accessible to competitors. What Happened: Zuckerberg, on the Joe Rogan Podcast episode 2255, expressed his concerns over Apple’s exclusive AirPods protocol, which provides effortless connectivity with iPhones, claiming it to be an unjust limitation on competitors. Zuckerberg rejected Apple’s assertions of privacy and security risks,",0.5720338877290487
"Trump Trade: Trump considers 50% tariff on EU, 25% on iPhones",2025-05-24 22:15:35,Yahoo,https://finnhub.io/api/news?id=e1fe27bc5b23661c2a8f8a4a1891f6eceb87a8e155bbcdf4256cec92144328e5,"Catch up on the top industries and stocks that were impacted, or were predicted to be impacted, by the comments, actions and policies of President Donald Trump with this daily recap compiled by The Fly: TARIFF ON EU: President Donald Trump stated in a post to Truth Social, “The European Union, which was formed for the primary purpose of taking advantage of the United States on TRADE, has been very difficult to deal with. Their powerful Trade Barriers, Vat Taxes, ridiculous Corporate Penalties, N","Catch up on the top industries and stocks that were impacted, or were predicted to be impacted, by the comments, actions and policies of President Donald Trump with this daily recap compiled by The Fly: TARIFF ON EU: President Donald Trump stated in a post to Truth Social, “The European Union, which was formed for the primary purpose of taking advantage of the United States on TRADE, has been very difficult to deal with. Their powerful Trade Barriers, Vat Taxes, ridiculous Corporate Penalties, N",0.7957752607762814
A Once-in-a-Decade Investment Opportunity: 1 Artificial Intelligence (AI) Chip Stock to Buy Hand Over Fist Right This Instant (Hint: It's Not Nvidia),2025-05-24 21:00:00,Yahoo,https://finnhub.io/api/news?id=6318500f7a896ec519ccf40089d6290c8805d9755d469371d81dfe3df2ed4565,"Advanced Micro Devices is experiencing robust growth in its data center business, but investors don't seem to be impressed.","Advanced Micro Devices is experiencing robust growth in its data center business, but investors don't seem to be impressed.",0.07239683344960213
"Meta, Broadcom Lead Five Stocks Forging New Buy Points In Market Pullback",2025-05-24 20:00:30,Yahoo,https://finnhub.io/api/news?id=0be435396a8363228beb5afd8bfc11621132dd866c58ed5bc297da8a35b88988,"Meta Platforms and Broadcom have new, lower buy points as the market pullback allowed the AI giants to forge handles last week.","Meta Platforms and Broadcom have new, lower buy points as the market pullback allowed the AI giants to forge handles last week.",0.5096800662577152
3 Reasons to Buy This Artificial Intelligence (AI) Stock Like There Is No Tomorrow,2025-05-24 18:45:00,Yahoo,https://finnhub.io/api/news?id=c8b9db61780fb4b914f0a94fb2f740f8c694fef8a1dc83e5e1a12849742b9e0f,"Meta Platforms has a vast ecosystem to monetize in the AI race.  The company is investing heavily in AI-related infrastructure.  Artificial intelligence (AI) isn't new, but novel applications of the technology have become extremely popular in the past few years.","Meta Platforms has a vast ecosystem to monetize in the AI race.  The company is investing heavily in AI-related infrastructure.  Artificial intelligence (AI) isn't new, but novel applications of the technology have become extremely popular in the past few years.",0.8502784594893456
5 Best CEFs This Month For Yields Up To 14% (May 2025),2025-05-24 16:00:00,SeekingAlpha,https://finnhub.io/api/news?id=b75c7d61e883a81f425a93fd499175b0ca3c9bb887e49e5974fcd7bdfea8be17,,,0.4601529985666275
Nvidia: 5 Channel Checks Ahead Of Earnings,2025-05-24 08:01:00,SeekingAlpha,https://finnhub.io/api/news?id=47c06c3bb28eb189696dff7a015343a59e627f9cd37957b64d68059bc04e3526,"Nvidia Corporation's Q1 earnings are coming May 28thâexplore their AI growth, business outlook, valuation, and risks. Click to see if NVDA stock is worth the hype.","Nvidia Corporation's Q1 earnings are coming May 28thâexplore their AI growth, business outlook, valuation, and risks. Click to see if NVDA stock is worth the hype.",0.9427558612078428
Columbia Balanced Fund Q1 2025 Commentary,2025-05-24 07:15:00,SeekingAlpha,https://finnhub.io/api/news?id=0385c794f7ed58aa50e2427ed31d1d76b351c3bcb93035845a5783a9f42968ef,,,0.9575831163674593
Nvidia Stock (NVDA) Maintains Bullish Tempo as Earnings Day of Reckoning Looms,2025-05-24 06:15:00,Yahoo,https://finnhub.io/api/news?id=ad83c328ff92e60503df64acd29b0e42bb863691c6e81a3f7cd4740377262c9c,"Nvidia (NVDA), the trailblazing AI-tech stock, has staged a remarkable comeback, surging 33% over the past month. While investor concerns around rising competition, escalating global tariffs, and macroeconomic uncertainties have weighed on NVDA’s performance, the company’s underlying growth trajectory, driven by AI innovation and data center expansion, remains robust. Given this foundation, NVDA presents an attractive buying opportunity at current levels. Moreover, with a keenly anticipated earn","Nvidia (NVDA), the trailblazing AI-tech stock, has staged a remarkable comeback, surging 33% over the past month. While investor concerns around rising competition, escalating global tariffs, and macroeconomic uncertainties have weighed on NVDA’s performance, the company’s underlying growth trajectory, driven by AI innovation and data center expansion, remains robust. Given this foundation, NVDA presents an attractive buying opportunity at current levels. Moreover, with a keenly anticipated earn",0.0387325519695878
Telegram 'surprised' as Vietnam orders messaging app to be blocked,2025-05-24 02:50:04,Finnhub,https://finnhub.io/api/news?id=d69ecaefaa792170def6963ff900c30116a05aa1656034cab4420d8344d210dc,"Vietnam's technology ministryhas ordered telecommunication service providers to block themessaging app Telegram for not cooperating in combating allegedcrimes committed by its users, in a move that...","Vietnam's technology ministryhas ordered telecommunication service providers to block themessaging app Telegram for not cooperating in combating allegedcrimes committed by its users, in a move that...",0.5092601357027888
The Stock Market Had a Bad Week. It’s Your Fault.,2025-05-24 01:51:00,MarketWatch,https://finnhub.io/api/news?id=d51e20d41b4cba18329458a8cdfea3f5b83958f48ca54398d806bcb2982c597d,The Stock Market Had a Bad Week. It’s Your Fault.,The Stock Market Had a Bad Week. It’s Your Fault.,0.5165774635970592
Meta Shares Dip as German Court Backs AI Data Use,2025-05-24 01:07:22,Yahoo,https://finnhub.io/api/news?id=e1110064d9f7f48d5a8e9142c4fbebd7a758f9c1fe295359a9f7f9099cbfb1ac,Meta down after injunction attempt over Facebook/Instagram data fails,Meta down after injunction attempt over Facebook/Instagram data fails,0.5115646859630942
Big Tech's spending drove Nvidia's rise,2025-05-23 23:40:27,Yahoo,https://finnhub.io/api/news?id=7955ed23d004cb543ec3c9e36423c606faf414de8298a7e23ed51a988926ef58,Bloomberg estimates that Microsoft spends roughly 47% of its capital expenditures directly on Nvidia’s chips and accounts for nearly 19% of Nvidia’s revenue on an annualized basis.,Bloomberg estimates that Microsoft spends roughly 47% of its capital expenditures directly on Nvidia’s chips and accounts for nearly 19% of Nvidia’s revenue on an annualized basis.,0.3777589052915573
"Wall Street Roundup: Retail Earnings, Reddit Volatility, AI Momentum",2025-05-23 22:45:00,SeekingAlpha,https://finnhub.io/api/news?id=bf0db67d57f32a208ef8cb262c470d857ad4c36c44603710a02c9ff67ed3cddc,Target post-earnings. More retail earnings. Reddit volatility. CoreWeave momentum.,Target post-earnings. More retail earnings. Reddit volatility. CoreWeave momentum.,0.8292561173439026
German rights group fails in bid to stop Meta's data use for AI,2025-05-23 21:06:21,Yahoo,https://finnhub.io/api/news?id=dcf053b17f1ed9dc4634d54441474ebfdd2b5ea6d394fb560178b36ba989b601,"The court in the western city of Cologne said it did not grant an injunction sought by state-funded consumer rights group Verbraucherzentrale NRW.  Meta said last month it would train its AI models in the European Union with public posts of adults across its platforms, as well as with interactions that users have with its artificial intelligence.","The court in the western city of Cologne said it did not grant an injunction sought by state-funded consumer rights group Verbraucherzentrale NRW.  Meta said last month it would train its AI models in the European Union with public posts of adults across its platforms, as well as with interactions that users have with its artificial intelligence.",0.8837518468499184
Alphabet Is Wiping Out The AI Competition,2025-05-23 20:44:54,SeekingAlpha,https://finnhub.io/api/news?id=855f612d0b26a241d9f557fed2a02efa1e649273cad733d9d69b8ed88bbb4514,"Alphabetâs all-in AI strategyâGemini models, custom TPUs, and unmatched product integrationâdelivers scale and innovation no rival can match.","Alphabetâs all-in AI strategyâGemini models, custom TPUs, and unmatched product integrationâdelivers scale and innovation no rival can match.",0.8375543430447578
AI chatbots taking over the internet aren’t just shaping your opinions. They’re threatening your personal data.,2025-05-23 18:37:00,MarketWatch,https://finnhub.io/api/news?id=12e6124890255885948440537ecc9acccecc086ebb3e42ac8f6bfb0b4b618112,AI chatbots taking over the internet aren’t just shaping your opinions. They’re threatening your personal data.,AI chatbots taking over the internet aren’t just shaping your opinions. They’re threatening your personal data.,0.7359219314530492
Big Tech ETF slumps as Apple falls after Trump says company faces potential tariff,2025-05-23 17:57:03,MarketWatch,https://finnhub.io/api/news?id=3b70371ab1ae0a81229c42459b68d46a358205830060e1c2bd3f5f333e064fea,Big Tech ETF slumps as Apple falls after Trump says company faces potential tariff,Big Tech ETF slumps as Apple falls after Trump says company faces potential tariff,0.5044157286174595
