title,date_published,news_outlet,article_link,summary,text,Sentiment_Score
Where the Stock Market Stands Now After a Wild Start to the Year,2025-05-31 20:00:07,Yahoo,https://finnhub.io/api/news?id=627480b3dc41e957bc55d7f2abf0d70d50f0344b5d440b54d36dc453a4484076,"(Bloomberg) -- The stock market’s crazy first five months of 2025 have left Wall Street pros in a bit of a pickle. Most Read from BloombergBillionaire Steve Cohen Wants NY to Expand Taxpayer-Backed FerryNow With Colorful Blocks, Tirana’s Pyramid Represents a Changing AlbaniaNYC Congestion Toll Brings In $216 Million in First Four MonthsThe Economic Benefits of Paying Workers to MoveWhere the Wild Children’s Museums AreComing off the best month for the S&P 500 Index in a year and a half and the b","(Bloomberg) -- The stock market’s crazy first five months of 2025 have left Wall Street pros in a bit of a pickle. Most Read from BloombergBillionaire Steve Cohen Wants NY to Expand Taxpayer-Backed FerryNow With Colorful Blocks, Tirana’s Pyramid Represents a Changing AlbaniaNYC Congestion Toll Brings In $216 Million in First Four MonthsThe Economic Benefits of Paying Workers to MoveWhere the Wild Children’s Museums AreComing off the best month for the S&P 500 Index in a year and a half and the b",0.37079212069511414
"Germany Considers 10% Digital Tax On Tech Giants Alphabet, Meta: Report",2025-05-31 18:45:12,Yahoo,https://finnhub.io/api/news?id=90fc4e3f37f8688d5fe0f256be6c869dc977317f75099279d75edfdd504e9212,"In a move that could escalate trade tensions with the U.S., Germany is reportedly contemplating imposing a 10% tax on major online platforms, including Alphabet Inc. (NASDAQ:GOOGL) (NASDAQ:GOOG) and Meta Platforms Inc. (NASDAQ:META). What Happened: Wolfram Weimer, the new German Minister of State for Culture, disclosed this proposal in an interview with Stern magazine. This revelation comes before Chancellor Friedrich Merz‘s anticipated visit to Washington, although no official confirmation has","In a move that could escalate trade tensions with the U.S., Germany is reportedly contemplating imposing a 10% tax on major online platforms, including Alphabet Inc. (NASDAQ:GOOGL) (NASDAQ:GOOG) and Meta Platforms Inc. (NASDAQ:META). What Happened: Wolfram Weimer, the new German Minister of State for Culture, disclosed this proposal in an interview with Stern magazine. This revelation comes before Chancellor Friedrich Merz‘s anticipated visit to Washington, although no official confirmation has",0.8382780943065882
"This ""Magnificent Seven"" Stock Is Set to Skyrocket If Its AI Investments Pay Off",2025-05-31 18:15:00,Yahoo,https://finnhub.io/api/news?id=07799edb3dde2a01ebe487cf5a0a691ede97524cc845d975ff4d8f9ea612c94c,"Meta Platforms has investments in several AI applications.  The tech giant's stock is only valued on its legacy business.  Over the past two-and-a-half years, investors have heard about various artificial intelligence (AI) investments that tech companies are making.","Meta Platforms has investments in several AI applications.  The tech giant's stock is only valued on its legacy business.  Over the past two-and-a-half years, investors have heard about various artificial intelligence (AI) investments that tech companies are making.",0.9211663138121367
AutoZone: Double-Digit Growth Amidst A Slowing Economy Makes It A Long-Term Buy,2025-05-31 15:45:00,SeekingAlpha,https://finnhub.io/api/news?id=f2f89a3b663baa0fa2d91898fb78f191401b86cbd2a9782e1347243640404385,"AutoZone's strong growth, international expansion, and free cash flow make it a long-term buy. Click for my updated look at AZO stock post Q1 earnings.","AutoZone's strong growth, international expansion, and free cash flow make it a long-term buy. Click for my updated look at AZO stock post Q1 earnings.",0.503309041261673
"The Amazon Paradox: Growth Potential, But Stalling Stock Price",2025-05-31 12:58:14,SeekingAlpha,https://finnhub.io/api/news?id=0ae871e0a51b4b7950d5b26e4dae15210c133272de120233bf0d63a65bc6c5b8,Amazon stock consolidates as growth faces challenges from retail tariffs and economic uncertainty. Read here for AMZN's long-term opportunities in AWS & AI.,Amazon stock consolidates as growth faces challenges from retail tariffs and economic uncertainty. Read here for AMZN's long-term opportunities in AWS & AI.,0.9141102135181427
"Trump ‘Revenge’ Tax Would Cut Foreign Investment, Congressional Panel Says",2025-05-31 02:29:34,Yahoo,https://finnhub.io/api/news?id=0f769f63196d4a352694d03b11f8a0fdfe6ad22efd08368e161299d1b7f660a4,"(Bloomberg) -- Congress’s own official tax scorekeeper is predicting a “revenge” tax buried in Donald Trump’s massive fiscal package would realize Wall Street’s fears and drive foreign investors away from US markets.Most Read from BloombergNow With Colorful Blocks, Tirana’s Pyramid Represents a Changing AlbaniaBillionaire Steve Cohen Wants NY to Expand Taxpayer-Backed FerryNYC Congestion Toll Brings In $216 Million in First Four MonthsThe Economic Benefits of Paying Workers to MoveWhere the Wild","(Bloomberg) -- Congress’s own official tax scorekeeper is predicting a “revenge” tax buried in Donald Trump’s massive fiscal package would realize Wall Street’s fears and drive foreign investors away from US markets.Most Read from BloombergNow With Colorful Blocks, Tirana’s Pyramid Represents a Changing AlbaniaBillionaire Steve Cohen Wants NY to Expand Taxpayer-Backed FerryNYC Congestion Toll Brings In $216 Million in First Four MonthsThe Economic Benefits of Paying Workers to MoveWhere the Wild",0.559635117650032
Meta Platforms (NasdaqGS:META) Announces US$0.53 Dividend for Shareholders,2025-05-31 01:25:11,Yahoo,https://finnhub.io/api/news?id=7d4cac5b0801781e041e9f8a49f1592f164ad5b910ac91c385bd57cd16d23b96,"Meta Platforms (NasdaqGS:META) recently declared a quarterly cash dividend of $0.53 per share, reflecting its continued commitment to shareholder value. Over the last month, the company's stock saw a notable price increase of 16%, possibly influenced by this announcement. Despite broader market uncertainties, Meta’s robust earnings growth and positive quarterly revenue guidance likely added weight to this upward trend. Additionally, the company's collaboration with Red Hat on generative AI...","Meta Platforms (NasdaqGS:META) recently declared a quarterly cash dividend of $0.53 per share, reflecting its continued commitment to shareholder value. Over the last month, the company's stock saw a notable price increase of 16%, possibly influenced by this announcement. Despite broader market uncertainties, Meta’s robust earnings growth and positive quarterly revenue guidance likely added weight to this upward trend. Additionally, the company's collaboration with Red Hat on generative AI...",0.035276043228805065
Why Is Meta Platforms (META) Up 12.7% Since Last Earnings Report?,2025-05-30 23:31:12,Yahoo,https://finnhub.io/api/news?id=bde405be1eb760a9791c56ee6e4ba3c1d3363a6fafaec6712920476cb8582099,Meta Platforms (META) reported earnings 30 days ago. What's next for the stock? We take a look at earnings estimates for some clues.,Meta Platforms (META) reported earnings 30 days ago. What's next for the stock? We take a look at earnings estimates for some clues.,0.9011172913014889
"Meta, Google Could Face Digital Services Tax In Germany Despite U.S. Pushback",2025-05-30 23:13:22,Yahoo,https://finnhub.io/api/news?id=0d23c57fb5f08a19a9c5271f8a10212c1631bcf3776ca73af70df4032b4462ef,Meta stock was flat and Google lower following news that Germany is considering a 10% tax on digital services.,Meta stock was flat and Google lower following news that Germany is considering a 10% tax on digital services.,0.5011574313975871
How The Fed And Uncertainty Can Push The S&P 500 Into A Correction,2025-05-30 21:29:36,SeekingAlpha,https://finnhub.io/api/news?id=ce699c6f78f540dd5d3dc5165ee13812bdcaf6fca434f1f1aaebeaa3f1176720,"Is the S&P 500 overvalued? Discover why economic risks and high P/E ratios signal a potential 7%-10% correction, plus opportunities for gains in 2026!","Is the S&P 500 overvalued? Discover why economic risks and high P/E ratios signal a potential 7%-10% correction, plus opportunities for gains in 2026!",0.5569126158952713
Tax bill contains 'sledgehammer' for Trump to retaliate against foreign digital taxes,2025-05-30 20:54:15,Finnhub,https://finnhub.io/api/news?id=089f748cf54bc48079274531f756a173c4d712545ce5e29188f182ee7a22c70a,"U.S. President DonaldTrump would have the power to retaliate against countries thatimpose special digital service taxes on large U.S. technologycompanies like Amazon and Alphabet, under a provision...","U.S. President DonaldTrump would have the power to retaliate against countries thatimpose special digital service taxes on large U.S. technologycompanies like Amazon and Alphabet, under a provision...",0.866422601044178
Mag 7 valuations before & after Nvidia earnings: Chart of the Day,2025-05-30 19:30:13,Yahoo,https://finnhub.io/api/news?id=55a97fcc92abbdff92fb8db236afd2b9892fb4a8c492308218984379604b73c6,"Now that Nvidia's (NVDA) earnings are in the books, Yahoo Finance host Julie Hyman takes a look at what Big Tech's valuations and forward price-to-earnings (P/E) ratios look like right now, particularly for the ""Magnificent Seven."" To watch more expert insights and analysis on the latest market action, check out more Asking for a Trend here.","Now that Nvidia's (NVDA) earnings are in the books, Yahoo Finance host Julie Hyman takes a look at what Big Tech's valuations and forward price-to-earnings (P/E) ratios look like right now, particularly for the ""Magnificent Seven."" To watch more expert insights and analysis on the latest market action, check out more Asking for a Trend here.",0.9354922361671925
German digital ministry treads cautiously over online platform levy,2025-05-30 19:23:26,Finnhub,https://finnhub.io/api/news?id=16a7bef8df0f376c66ee3165a90d2ad2635cf50886a04ce54651bb70efeb2942,"Germany's new digitalministry said any levy on online platforms would have to beinternationally coordinated and not result in higher prices forend consumers, in a sign on Friday of possible...","Germany's new digitalministry said any levy on online platforms would have to beinternationally coordinated and not result in higher prices forend consumers, in a sign on Friday of possible...",0.3668539896607399
"OpenAI risks being undercut by cheaper rivals, says star investor",2025-05-30 19:00:09,Yahoo,https://finnhub.io/api/news?id=408d055961eb9d5cf1614029faa0ce8ec3ca76243f2e19a85bbc20e44d7b6b5c,US groups such as OpenAI which are racing to develop artificial intelligence are at risk of being undercut by cheaper rivals such as China’s...,US groups such as OpenAI which are racing to develop artificial intelligence are at risk of being undercut by cheaper rivals such as China’s...,0.5231498554348946
FEPI Vs. QDTE: Both Funds Offer A Unique Value Proposition,2025-05-30 18:50:23,SeekingAlpha,https://finnhub.io/api/news?id=a53e9b0689da4a27714ddad72dc8f14bdff81ff0334429f74adb995aa432b559,,,0.361842080950737
"As An Investor, I Wish It Was 1999",2025-05-30 18:38:58,SeekingAlpha,https://finnhub.io/api/news?id=e2ad5ddb5cc53690c4ee146f79f77661d4b823b0470c9d5c93cef6e7ad10a5a6,"Explore why today's market risks surpass those of 1999's Internet Boom with insights on economic, geopolitical & market conditions. Click to read why stocks are more overbought now.","Explore why today's market risks surpass those of 1999's Internet Boom with insights on economic, geopolitical & market conditions. Click to read why stocks are more overbought now.",0.9293491784483194
Weitz Partners III Opportunity Fund Q1 2025 Commentary,2025-05-30 17:57:00,SeekingAlpha,https://finnhub.io/api/news?id=da8cfa95344ccaca83ec538b7dc3a9dd78f7140f85d4404bab110e7e9f3fc588,"The Partners III Opportunity Fundâs Institutional Class returned -0.45% for the first quarter of 2025, comparing favorably to the Russell 3000 Indexâs return of -4.72%.","The Partners III Opportunity Fundâs Institutional Class returned -0.45% for the first quarter of 2025, comparing favorably to the Russell 3000 Indexâs return of -4.72%.",0.052744289860129356
Weitz Multi Cap Equity Fund Q1 2025 Commentary,2025-05-30 17:24:00,SeekingAlpha,https://finnhub.io/api/news?id=fed842ba6501204b15c506e5f69f4479c540a2c3fb665c5162e28a6dc92a1290,"The Multi Cap Equity Fundâs Institutional Class returned +0.81% for the quarter, comparing favorably to the Russell 3000 Indexâs loss of -4.72%.","The Multi Cap Equity Fundâs Institutional Class returned +0.81% for the quarter, comparing favorably to the Russell 3000 Indexâs loss of -4.72%.",0.05630337353795767
Apple: Double-Down When The Market Gets Silly,2025-05-30 16:00:00,SeekingAlpha,https://finnhub.io/api/news?id=41811e2fd73c54d46e61dbfdaa670fe34ea4ee7a1b7efd4f466e10073719487d,"Apple is down 20%, but historical trends suggest a rebound. Appleâs history as a capable supply chain manager provides resilience. See more on AAPL stock here.","Apple is down 20%, but historical trends suggest a rebound. Appleâs history as a capable supply chain manager provides resilience. See more on AAPL stock here.",0.47533101961016655
abrdn Global Dynamic Dividend Fund Q1 2025 Commentary,2025-05-30 15:40:00,SeekingAlpha,https://finnhub.io/api/news?id=38d483e94c6ba4dd4621b8b721cdda26ae089a39d87c688a4830fb044d9ce77f,"The abrdn Global Dynamic Dividend Fund outperformed its benchmark over the three-month period ending 30 April 2025 due to stock selection and, to a lesser extent, sector allocation.","The abrdn Global Dynamic Dividend Fund outperformed its benchmark over the three-month period ending 30 April 2025 due to stock selection and, to a lesser extent, sector allocation.",0.2101069800555706
Microsoft And Meta: Post-Earnings Updates To The Outlook,2025-05-30 15:26:00,SeekingAlpha,https://finnhub.io/api/news?id=c52c0b8bc98f858a538548b1984852d71828892ed66fe6d956fb6532406bc3f8,"For Microsoft and Meta Platforms, this earnings season demonstrated the resilience of their core businesses, despite uncertainty from tariffs.","For Microsoft and Meta Platforms, this earnings season demonstrated the resilience of their core businesses, despite uncertainty from tariffs.",0.04046199098229408
"Wall Street Breakfast Podcast: Big Tech, Big Rulings, Big Rebounds",2025-05-30 14:53:45,SeekingAlpha,https://finnhub.io/api/news?id=7d3f3b93fa061d19c2f8f3322f208d6d98711ab02d6c9ba49c96cddb611dd7b2,,,0.9054833985865116
"Meta (META) AI Reaches 1 Billion Users, Eyes Paid Features and Subscriptions",2025-05-30 13:28:11,Yahoo,https://finnhub.io/api/news?id=57046c390ff3662dd194cdae2b289b06c5d54e4ae2ad1e123d0a982887669238,"We recently published a list of 10 AI Stocks on Wall Street’s Radar. In this article, we are going to take a look at where Meta Platforms, Inc. (NASDAQ:META) stands against other AI stocks on Wall Street’s radar. Meta Platforms, Inc. (NASDAQ:META) is a global technology company. On May 28, CNBC reported that Meta Platforms, Inc. (NASDAQ:META)’s artificial […]","We recently published a list of 10 AI Stocks on Wall Street’s Radar. In this article, we are going to take a look at where Meta Platforms, Inc. (NASDAQ:META) stands against other AI stocks on Wall Street’s radar. Meta Platforms, Inc. (NASDAQ:META) is a global technology company. On May 28, CNBC reported that Meta Platforms, Inc. (NASDAQ:META)’s artificial […]",0.9354689307510853
Weitz Large Cap Equity Fund Q1 2025 Commentary,2025-05-30 13:27:00,SeekingAlpha,https://finnhub.io/api/news?id=20be1557f8321ddb46f87971d737ec67a2d13c4703af4bb7743a8cf49610d101,,,0.9513946231454611
CoreWeave Is Building an AI Cloud Empire. The Stock Is a Puzzle.,2025-05-30 11:30:00,MarketWatch,https://finnhub.io/api/news?id=62138749248855374bd5c6e4d00aff80fd7d3d7baf7d02ef4b15b06ac666066f,CoreWeave Is Building an AI Cloud Empire. The Stock Is a Puzzle.,CoreWeave Is Building an AI Cloud Empire. The Stock Is a Puzzle.,0.9427713993936777
Wall Street Roundup: The Fog Of Tariffs,2025-05-30 09:24:44,SeekingAlpha,https://finnhub.io/api/news?id=4c2297fdb06e871f3c102acfc149dd1e8457126dbc6be2d4f3a274c65f2b107b,Nvidia gets another shrug from Wall Street post-earnings and tariff uncertainty continues.,Nvidia gets another shrug from Wall Street post-earnings and tariff uncertainty continues.,0.512867271900177
"X Launches New Chat Experience in Beta, a Precursor to Payments",2025-05-30 05:44:06,Yahoo,https://finnhub.io/api/news?id=2addfeb1be082685b43168f0c3576f3c232b977fb266d9c9dede1c3fb4b11ea9,"The new chat experience has enhanced safety, which is a key consideration for the next stage.","The new chat experience has enhanced safety, which is a key consideration for the next stage.",0.2945049852132797
Tracking Ray Dalio's Bridgewater Associates 13F Portfolio - Q1 2025 Update,2025-05-30 04:53:50,SeekingAlpha,https://finnhub.io/api/news?id=065e3ec67a0a852f8de27f888c48bbc88870b963b8035abf2eaab07f900ec8b7,"See an update on Bridgewater Associates' Q1'25 portfolio shifts, highlighting top stock changes in tech and retail, diversification strategies, & key holdings.","See an update on Bridgewater Associates' Q1'25 portfolio shifts, highlighting top stock changes in tech and retail, diversification strategies, & key holdings.",0.916452769190073
Meta Announces Quarterly Cash Dividend,2025-05-30 04:30:00,Yahoo,https://finnhub.io/api/news?id=e1ded6ea8744a6178303b16754f60e6ff37c5ff5b0ba48807e776344e1751a03,"The Meta Platforms, Inc. (Nasdaq: META) board of directors today declared a quarterly cash dividend of $0.525 per share of the company's outstanding Class A common stock and Class B common stock, payable on June 26, 2025 to stockholders of record as of the close of business on June 16, 2025.","The Meta Platforms, Inc. (Nasdaq: META) board of directors today declared a quarterly cash dividend of $0.525 per share of the company's outstanding Class A common stock and Class B common stock, payable on June 26, 2025 to stockholders of record as of the close of business on June 16, 2025.",0.8784000501036644
"Jim Cramer on Meta Platforms, Inc. (META) Stock: “Good Level to Buy”",2025-05-30 04:21:48,Yahoo,https://finnhub.io/api/news?id=ec9955edc50589a1694d3ca3c771201666f7345a78c12951f48e1d8ca4997357,"We recently published a list of Jim Cramer Put These 14 Stocks Under the Microscope. In this article, we are going to take a look at where Meta Platforms, Inc. (NASDAQ:META) stands against other stocks that Jim Cramer discusses. When a caller expressed that they are considering starting a position in Meta Platforms, Inc. (NASDAQ:META) […]","We recently published a list of Jim Cramer Put These 14 Stocks Under the Microscope. In this article, we are going to take a look at where Meta Platforms, Inc. (NASDAQ:META) stands against other stocks that Jim Cramer discusses. When a caller expressed that they are considering starting a position in Meta Platforms, Inc. (NASDAQ:META) […]",0.9447541646659374
Famous Investor Remains Very Upbeat on META Platforms (META),2025-05-30 04:15:31,Yahoo,https://finnhub.io/api/news?id=92161ca7bd09347cc4270bca0f47a6ad46c0754ea2cbfa43a901f74bdba31017,"Meta Platforms, Inc. (NASDAQ:META) and its CEO, Mark Zuckerberg, are “delivering” and “executing,” while the tech giant’s “fundamentals” are strong, Stephanie Link, who frequently appears on CNBC, said on the channel recently. Link is the Chief Investment Strategist at Hightower Advisors. Meta Platforms, Inc. (NASDAQ:META) Reported “Great” Q1 Results, Link Says The advertising behemoth delivered […]","Meta Platforms, Inc. (NASDAQ:META) and its CEO, Mark Zuckerberg, are “delivering” and “executing,” while the tech giant’s “fundamentals” are strong, Stephanie Link, who frequently appears on CNBC, said on the channel recently. Link is the Chief Investment Strategist at Hightower Advisors. Meta Platforms, Inc. (NASDAQ:META) Reported “Great” Q1 Results, Link Says The advertising behemoth delivered […]",0.1871168240904808
Obscure Tax Item in Trump’s Big Bill Stokes Wall Street Angst,2025-05-30 03:56:08,Yahoo,https://finnhub.io/api/news?id=19b441a27eae9182dc2a6700127c7c06bc863b5e7892c76eaec401fa69b7e8d1,"(Bloomberg) -- Buried deep in the more than 1,000-page tax-and-spending bill that President Donald Trump is muscling through Congress is an obscure tax measure that’s setting off alarms on Wall Street and beyond.Most Read from BloombergNYC Congestion Toll Brings In $216 Million in First Four MonthsNow With Colorful Blocks, Tirana’s Pyramid Represents a Changing AlbaniaNY Wins Order Against US Funding Freeze in Congestion FightThe Economic Benefits of Paying Workers to MoveNY Congestion Pricing I","(Bloomberg) -- Buried deep in the more than 1,000-page tax-and-spending bill that President Donald Trump is muscling through Congress is an obscure tax measure that’s setting off alarms on Wall Street and beyond.Most Read from BloombergNYC Congestion Toll Brings In $216 Million in First Four MonthsNow With Colorful Blocks, Tirana’s Pyramid Represents a Changing AlbaniaNY Wins Order Against US Funding Freeze in Congestion FightThe Economic Benefits of Paying Workers to MoveNY Congestion Pricing I",0.8827147148549557
Meta working with Anduril on AR/VR military tech for soldiers,2025-05-30 03:53:28,Yahoo,https://finnhub.io/api/news?id=67facd1e9c34bfa85dd16d2e55cded2ad2d28fc65ee27cc71422e7b564d4df7b,Meta is joining forces with Anduril to produce tech for soldiers.,Meta is joining forces with Anduril to produce tech for soldiers.,0.6461519449949265
"Meta Hits 1 Billion Monthly AI Users, Eyes Future With Subscriptions",2025-05-30 03:36:25,Yahoo,https://finnhub.io/api/news?id=60f89c948ae5e064acca6b4b290188027023089553e17155a08e1db0ba490306,"Meta Platforms, Inc (NASDAQ:META) artificial intelligence assistant now has one billion monthly active users, CEO Mark Zuckerberg said Wednesday at the company's annual shareholder meeting. Zuckerberg emphasized focus on making Meta AI the leading personal AI, emphasizing personalization, voice conversations, and entertainment, CNBC reported on Wednesday. In April, Meta launched a stand-alone AI app to compete with the likes of OpenAI's ChatGPT, Alphabet Inc (NASDAQ:GOOG) (NASDAQ:GOOGL) Google's","Meta Platforms, Inc (NASDAQ:META) artificial intelligence assistant now has one billion monthly active users, CEO Mark Zuckerberg said Wednesday at the company's annual shareholder meeting. Zuckerberg emphasized focus on making Meta AI the leading personal AI, emphasizing personalization, voice conversations, and entertainment, CNBC reported on Wednesday. In April, Meta launched a stand-alone AI app to compete with the likes of OpenAI's ChatGPT, Alphabet Inc (NASDAQ:GOOG) (NASDAQ:GOOGL) Google's",0.5710597634315491
Meta: Seamless Integration Of AI Services Can Change The Game,2025-05-30 01:53:27,SeekingAlpha,https://finnhub.io/api/news?id=673c57ee11665417246f87014fda127c9c7575501c99a722d7a092444fd6c6ca,"Discover how Meta's AI investments drive ad growth, new monetization channels, and market leadership amid challenges. Click here to read my most recent analysis.","Discover how Meta's AI investments drive ad growth, new monetization channels, and market leadership amid challenges. Click here to read my most recent analysis.",0.789644829928875
ETB: Hard To Recommend This Fund In A Bull Market,2025-05-30 01:29:32,SeekingAlpha,https://finnhub.io/api/news?id=121a4a7ceefcf5b447ce8776868b781fc1849549fc91025f965b9f5d2f05ac0c,"Read about ETB's 9.2% yield, its performance limits in bull markets, and why ETY might be a better choice for long-term growth.","Read about ETB's 9.2% yield, its performance limits in bull markets, and why ETY might be a better choice for long-term growth.",0.8630641289055347
Meta Platforms Inc Declares Quarterly Cash Dividend Of $0.525 Per Share,2025-05-30 01:29:12,Finnhub,https://finnhub.io/api/news?id=b74ab11c76eb1f5ca8bf09b2496110370a3340a4bccf19a20ed2e97bdf447aa1,Meta Platforms Inc: * META PLATFORMS INC - DECLARES QUARTERLY CASH DIVIDEND OF$0.525PER SHARESource text:Further company coverage: ...,Meta Platforms Inc: * META PLATFORMS INC - DECLARES QUARTERLY CASH DIVIDEND OF$0.525PER SHARESource text:Further company coverage: ...,0.9514607535675168
Nvidia’s Most Impressive Feat Yet? How the Chip Maker Overcame a China Ban.,2025-05-30 00:47:00,MarketWatch,https://finnhub.io/api/news?id=98d513464937b903791eae8079abdf9533d9c91eeb6a4087c8b07958ec7055ca,Nvidia’s Most Impressive Feat Yet? How the Chip Maker Overcame a China Ban.,Nvidia’s Most Impressive Feat Yet? How the Chip Maker Overcame a China Ban.,0.3337814658880234
Meta Outlines Latest Updates to its Marketing and Graph APIs,2025-05-30 00:41:44,Yahoo,https://finnhub.io/api/news?id=c58d34afa916d1124aaacd9f65ec8c49cc9a0870a693430e4900a3c77a97df75,A range of updates for those utilizing Meta's system access tools.,A range of updates for those utilizing Meta's system access tools.,0.9548738058656454
Meta Says Community Notes is Working Based on Latest Enforcement Data,2025-05-30 00:08:02,Yahoo,https://finnhub.io/api/news?id=3a6a6a9f1ef0f3debbea70d15af6931c342b56caca8af5e89c541f2813da2062,The latest insight into Meta's moderation and rule enforcement efforts.,The latest insight into Meta's moderation and rule enforcement efforts.,0.9053155221045017
"Meta Fired Palmer Luckey. Now, They’re Teaming Up on a Defense Contract.",2025-05-30 00:01:00,Yahoo,https://finnhub.io/api/news?id=6164107afa4f8f3f621713e18ce0471dfb8b91975204d94b7d36c86068365a1f,The Facebook and Instagram parent is partnering with Luckey’s Anduril Industries to develop combat VR headsets for the Army.,The Facebook and Instagram parent is partnering with Luckey’s Anduril Industries to develop combat VR headsets for the Army.,0.757252037525177
