title,date_published,news_outlet,article_link,summary,text,Sentiment_Score
Big Tech stocks pare gains as uncertainty looms over Trump tariffs,2025-05-29 23:59:15,Yahoo,https://finnhub.io/api/news?id=87af30d0ec2d131bd9658b5a77d4b8b8d9fff9a70b754eaada4261c99b9f3b51,Big Tech stocks pared gains after a brief spike Thursday morning following a US trade court decision that invalidates the vast majority of Trump’s global tariffs.,Big Tech stocks pared gains after a brief spike Thursday morning following a US trade court decision that invalidates the vast majority of Trump’s global tariffs.,0.24644887074828148
Madison Covered Call & Equity Income Fund Q1 2025 Investment Strategy Letter,2025-05-29 23:57:00,SeekingAlpha,https://finnhub.io/api/news?id=43556fe92240db93ab787bdcbe7e2b77cce16437a7b5e0a509579ccef446c731,"Over the full quarter, the S&P 500 lost 4.3% while the CBOE S&P 500 Buy-Write Index fell 3.1%. The Fund (class Y) outperformed both benchmarks, posting a 1.9% decline.","Over the full quarter, the S&P 500 lost 4.3% while the CBOE S&P 500 Buy-Write Index fell 3.1%. The Fund (class Y) outperformed both benchmarks, posting a 1.9% decline.",0.5017673894762993
Mark Zuckerberg Eyes Paid Meta AI Model After Hitting 1 Billion Users,2025-05-29 22:26:32,Yahoo,https://finnhub.io/api/news?id=8b67cc773ea6eb60b494b077a508f8abec9600158e0870af253efbea575db556,"Meta AI Hits 1 Billion Users, Monetization Plan Sparks Investor Buzz","Meta AI Hits 1 Billion Users, Monetization Plan Sparks Investor Buzz",0.1863713413476944
Broadcom Q2 Earnings Preview: The AI And Cloud Boom That's Far From Over,2025-05-29 22:11:53,SeekingAlpha,https://finnhub.io/api/news?id=8fccac02015af0a0db5b85852be6389e5a7ee6b6705ccd75a9c81f7183fed980,"Broadcom remains a strong Buy with a $265 target, backed by hyperscaler investments and XPU partnerships. Click here to find out why AVGO stock is a Buy.","Broadcom remains a strong Buy with a $265 target, backed by hyperscaler investments and XPU partnerships. Click here to find out why AVGO stock is a Buy.",0.42319388687610626
Microsoft Shares Go From Laggard to Leader as AI Growth Improves,2025-05-29 21:40:09,Yahoo,https://finnhub.io/api/news?id=55c963ae97ba5c189d6faf9d132e63fbc07e789a7a858dd57b97b78309bdaada,"(Bloomberg) -- After languishing for months, Microsoft Corp. shares are back within striking distance of a record high amid signs that performance in its Azure cloud-computing business is back on track. Most Read from BloombergNYC Congestion Toll Brings In $216 Million in First Four MonthsNY Wins Order Against US Funding Freeze in Congestion FightNow With Colorful Blocks, Tirana’s Pyramid Represents a Changing AlbaniaNY Congestion Pricing Is Likely to Stay Until Year End During Court CaseThe sof","(Bloomberg) -- After languishing for months, Microsoft Corp. shares are back within striking distance of a record high amid signs that performance in its Azure cloud-computing business is back on track. Most Read from BloombergNYC Congestion Toll Brings In $216 Million in First Four MonthsNY Wins Order Against US Funding Freeze in Congestion FightNow With Colorful Blocks, Tirana’s Pyramid Represents a Changing AlbaniaNY Congestion Pricing Is Likely to Stay Until Year End During Court CaseThe sof",0.12720655277371407
Apple is falling behind its Magnificent 7 rivals. Should it just be the Mag 6?,2025-05-29 20:14:19,Yahoo,https://finnhub.io/api/news?id=aa893f254949d2bf8a85bdc76e57377ed2109e27c47219ed7a509ac41bb14c84,"The “Magnificent Seven” tech stocks led the market’s post-pandemic boom. But as Big Tech sprints into the AI future, one big name is falling dangerously behind: Apple (AAPL). Once an undisputed tech heavyweight, it risks becoming the least magnificent of them all.","The “Magnificent Seven” tech stocks led the market’s post-pandemic boom. But as Big Tech sprints into the AI future, one big name is falling dangerously behind: Apple (AAPL). Once an undisputed tech heavyweight, it risks becoming the least magnificent of them all.",0.5431163692846894
Big Tech ETF climbs as Nvidia’s rally tops all other stocks in the Dow,2025-05-29 18:38:59,MarketWatch,https://finnhub.io/api/news?id=38207a284aa6f0a50ccd3d517875911580d515818655d68db11bf717bf7e1b2f,Big Tech ETF climbs as Nvidia’s rally tops all other stocks in the Dow,Big Tech ETF climbs as Nvidia’s rally tops all other stocks in the Dow,0.06145293265581131
Update: Market Chatter: Meta Plans Physical Store Expansion to Support Hardware Sales,2025-05-29 17:29:01,Yahoo,https://finnhub.io/api/news?id=7cd944421ccc44e0b5b3a11c7a35c43d70d7a5c791c0115ed255c4187a5f1a73,(Updates to include Meta's response in the last paragraph.) Meta Platforms (META) has been workin,(Updates to include Meta's response in the last paragraph.) Meta Platforms (META) has been workin,0.17368488013744354
The Mag 7 Aren’t Clones. How to Decide What to Buy Now.,2025-05-29 16:48:00,MarketWatch,https://finnhub.io/api/news?id=e5eaed5811b2aca31bbd99cb44d80b4011e47130656b713d7dd9ddc4ce81f07a,The Mag 7 Aren’t Clones. How to Decide What to Buy Now.,The Mag 7 Aren’t Clones. How to Decide What to Buy Now.,0.9535488542169333
"Billionaires Philippe Laffont, Chase Coleman, Terry Smith, and Stephen Mandel All Share the Same No. 1 Holding -- and It's Not Nvidia",2025-05-29 15:51:00,Yahoo,https://finnhub.io/api/news?id=6c7bf54cc696de6ab1b46ead4cd077a9a98a0d8d4a557a5dbc6f1d835d69d8b3,"This ""Magnificent"" stock that all four prominent billionaires have as their top holding has surged 1,570% since its initial public offering.","This ""Magnificent"" stock that all four prominent billionaires have as their top holding has surged 1,570% since its initial public offering.",0.4394179880619049
"AMD Isn't The Next Nvidia, But It Doesn't Need To Be",2025-05-29 15:15:00,SeekingAlpha,https://finnhub.io/api/news?id=c2834e0e760baa5bba3b25cff3e491538d0636aae1bf5322525662ecdd5fada1,,,0.9464872069656849
"Hanoi bans The Economist's printed issue with Vietnam's top leader on cover, say distributor sources",2025-05-29 14:48:15,Finnhub,https://finnhub.io/api/news?id=7a13a0682d6c73fa73c0e1887eb47ca0781ef99d15efe1d8872cc54de3c56de7,"The Economist's latest printededition for Asia featuring Vietnam's top leader To Lam on itscover has been banned in Vietnam, sources at two local mediadistributors told Reuters, in a new instance...","The Economist's latest printededition for Asia featuring Vietnam's top leader To Lam on itscover has been banned in Vietnam, sources at two local mediadistributors told Reuters, in a new instance...",0.564945672173053
TCW Relative Value Large Cap Fund Q1 2025 Commentary,2025-05-29 14:16:00,SeekingAlpha,https://finnhub.io/api/news?id=5c468935eeed3302bc71bba57bfa5156ce86a0236039f8631a3606ccf4ffbbaa,,,0.9514149278402328
"Mark Zuckerberg's goat is now worth $110,000 — sort of",2025-05-29 06:42:59,Yahoo,https://finnhub.io/api/news?id=160e4ab3cd3764194e04a1c075c6091697f5b793bc78a502724c4a28c9c53f95,"Mark Zuckerberg once named a goat ""Bitcoin""—and with BTC nearing $110,000, the internet jokes his pet is now worth six figures. Here's the quirky backstory.","Mark Zuckerberg once named a goat ""Bitcoin""—and with BTC nearing $110,000, the internet jokes his pet is now worth six figures. Here's the quirky backstory.",0.9497472196817398
Salesforce Says AI Has Reduced Hiring of Engineers and Customer Service Workers,2025-05-29 06:34:12,Yahoo,https://finnhub.io/api/news?id=192e51b91d0039cac5d6f2f52cbd0d35814b9c6a2e4645693af7132cfd1aa9a9,"(Bloomberg) -- Salesforce Inc. said the use of artificial intelligence tools internally has allowed it to hire fewer workers, another example of a company changing its hiring plans due to the emerging technology.Most Read from BloombergNYC Congestion Toll Brings In $216 Million in First Four MonthsNY Wins Order Against US Funding Freeze in Congestion FightNY Congestion Pricing Is Likely to Stay Until Year End During Court Case“We have reduced some of our hiring needs,” Chief Financial and Operat","(Bloomberg) -- Salesforce Inc. said the use of artificial intelligence tools internally has allowed it to hire fewer workers, another example of a company changing its hiring plans due to the emerging technology.Most Read from BloombergNYC Congestion Toll Brings In $216 Million in First Four MonthsNY Wins Order Against US Funding Freeze in Congestion FightNY Congestion Pricing Is Likely to Stay Until Year End During Court Case“We have reduced some of our hiring needs,” Chief Financial and Operat",0.5018177619203925
Tracking Terry Smith's Fundsmith 13F Portfolio - Q1 2025 Update,2025-05-29 06:09:49,SeekingAlpha,https://finnhub.io/api/news?id=a1fd3663dd9437c15f4f0e731c68ffcfa0c874c6a7695eaf106a72b54c8304e4,,,0.9505147524178028
RGA Investment Advisors Q1 2025 Investment Commentary,2025-05-29 05:30:00,SeekingAlpha,https://finnhub.io/api/news?id=4dee0ba7f00380d26b1305312c50ac64ababf593c379ada4279c4b7699f12336,"In their Q1 2025 RGA Investment Advisors discuss navigating market uncertainty, AI, and Life Sciences. Click here to read the full fund letter.","In their Q1 2025 RGA Investment Advisors discuss navigating market uncertainty, AI, and Life Sciences. Click here to read the full fund letter.",0.9637557277455926
"META Investors Have Opportunity to Join Meta Platforms, Inc. Fraud Investigation with the Schall Law Firm",2025-05-29 03:51:03,Finnhub,https://finnhub.io/api/news?id=50d02768cccfc3b5d8232c56822eda4cd03ca0c03b5ffd095ac99e8200ff80d0,"The Schall Law Firm, a national shareholder rights litigation firm, announces that it is investigating claims on behalf of investors of Meta Platforms, Inc. for violations of the securities...","The Schall Law Firm, a national shareholder rights litigation firm, announces that it is investigating claims on behalf of investors of Meta Platforms, Inc. for violations of the securities...",0.8293046578764915
"MAGS: The Correction Reversed, But Big Tech Fundamentals Continue To Deteriorate",2025-05-29 01:56:47,SeekingAlpha,https://finnhub.io/api/news?id=d26f324a17106b4312c32a6e736ff5ddb6cf59dc05140d698486a65801a0a200,,,0.49001734470948577
Meta Platforms (NasdaqGS:META) Faces Shareholder Proposal on Combating Hate Speech,2025-05-29 01:41:46,Yahoo,https://finnhub.io/api/news?id=b5c72a7d453ed40bafe63eab43c25c39ebf4e0a07ad4427feb2c7013bf6ae725,"Over the past month, Meta Platforms (NasdaqGS:META) experienced a stock price increase of 17%, influenced significantly by a recommendation from proxy advisory firms to support a shareholder proposal for reporting on anti-hate practices. This aligns with investors' recent emphasis on governance and ethical operations. Moreover, strong Q1 earnings marked by a substantial rise in net income and partnerships with Red Hat and others to advance AI development, complemented this positive momentum...","Over the past month, Meta Platforms (NasdaqGS:META) experienced a stock price increase of 17%, influenced significantly by a recommendation from proxy advisory firms to support a shareholder proposal for reporting on anti-hate practices. This aligns with investors' recent emphasis on governance and ethical operations. Moreover, strong Q1 earnings marked by a substantial rise in net income and partnerships with Red Hat and others to advance AI development, complemented this positive momentum...",0.03332780674099922
Market Chatter: Meta Platforms Plans Physical Store Expansion to Support Hardware Sales,2025-05-29 00:36:03,Yahoo,https://finnhub.io/api/news?id=0502a8489d51bb4294e862f8967515faf2f295e0e5348b3a16bb8310d2d0478c,Meta Platforms (META) has been working on plans to open physical stores and hire retail staff to sup,Meta Platforms (META) has been working on plans to open physical stores and hire retail staff to sup,0.32169221341609955
Judge denies US Copyright Office director's request to halt her firing,2025-05-29 00:01:09,Finnhub,https://finnhub.io/api/news?id=2bb5188b8325ac248feebe2034e845cef00e5f6a6762a7ccf24505ea334b1fff,"A federal judge in Washington, D.C.,on Wednesday rejected U.S. Copyright Office Director ShiraPerlmutter's emergency bid to block the Trump administrationfrom firing her. U.S....","A federal judge in Washington, D.C.,on Wednesday rejected U.S. Copyright Office Director ShiraPerlmutter's emergency bid to block the Trump administrationfrom firing her. U.S....",0.5152037129737437
"Is Meta Stock A Buy? Facebook Parent Shares Rebound After Tariff Deal, Q1 Earnings",2025-05-28 23:31:00,Yahoo,https://finnhub.io/api/news?id=9c3f3807dd2bcae7892b976ed47c2b7b026b8da7ecbb798d39a42d1fbd9927e7,"Meta Platforms stock is attempting to rally back after a three month slump.  Shares of the Facebook parent company are ahead 17% in May, after slumping 5% in April, 14% in March and 3% in February.  Meta stock was hit by fears about tariffs and the removal of the ""de minimis"" import exemption slowing its advertising business.","Meta Platforms stock is attempting to rally back after a three month slump.  Shares of the Facebook parent company are ahead 17% in May, after slumping 5% in April, 14% in March and 3% in February.  Meta stock was hit by fears about tariffs and the removal of the ""de minimis"" import exemption slowing its advertising business.",0.4778648759238422
Meta’s content moderation under scrutiny as ADL-backed proposal garners investor support,2025-05-28 22:57:10,Yahoo,https://finnhub.io/api/news?id=9341ed23627072c74414615bc27aa577ff3ebb0af1a3e949cfe902be65a2c11a,A Meta shareholder proposal sponsored by ADL affiliate JLens has gained the backing of two proxy advisory firms. The proposal calls on the social media giant to produce a comprehensive report on its handling of hate content.,A Meta shareholder proposal sponsored by ADL affiliate JLens has gained the backing of two proxy advisory firms. The proposal calls on the social media giant to produce a comprehensive report on its handling of hate content.,0.46196623146533966
AI: Two Types Of Value Are The Key To Understanding The Future Market,2025-05-28 22:34:02,SeekingAlpha,https://finnhub.io/api/news?id=a12b5b2667cb7793e53062f9080eb4943438ef0712135054cea23e25f91d2f97,,,0.9243781715631485
Nvidia’s earnings call must deliver on 3 things or else,2025-05-28 22:00:13,Yahoo,https://finnhub.io/api/news?id=d59bbb209fbbaa06385e7591ac86873d8708acacd1d0e08cfcaef99f1e8c2f37,"Nvidia will report its first-quarter results for fiscal year 2026 after the market closes on May 28. Despite slowing sales, analysts expect positive results for EPS and revenue. This earnings report is about more than just Nvidia; it’s a bellwether for the AI boom as a whole, which is showing signs of abatement. Yahoo Finance Executive Editor and host of the Opening Bid podcast, Brian Sozzi, breaks down the top three things investors should watch for during Nvidia's earnings call.","Nvidia will report its first-quarter results for fiscal year 2026 after the market closes on May 28. Despite slowing sales, analysts expect positive results for EPS and revenue. This earnings report is about more than just Nvidia; it’s a bellwether for the AI boom as a whole, which is showing signs of abatement. Yahoo Finance Executive Editor and host of the Opening Bid podcast, Brian Sozzi, breaks down the top three things investors should watch for during Nvidia's earnings call.",0.874334242194891
'Magnificent Seven' ETF wobbles as Big Tech stocks trade mixed ahead of Nvidia earnings,2025-05-28 21:52:53,MarketWatch,https://finnhub.io/api/news?id=3f158b0171410b3edf7f12920cb165bfc9a7c473f7c199c4bea12a5ce8c24648,'Magnificent Seven' ETF wobbles as Big Tech stocks trade mixed ahead of Nvidia earnings,'Magnificent Seven' ETF wobbles as Big Tech stocks trade mixed ahead of Nvidia earnings,0.5107790324836969
Independent Proxy Advisory Firms Supports JLens? Proposal,2025-05-28 20:36:23,Finnhub,https://finnhub.io/api/news?id=770ca4d70167f42b799ca8325ea887f3c28682d225355cef08c4787c81cbaf6e,"On May 28, 2025, JLens announced that independent proxy advisory firms Institutional Shareholder Services Glass, Lewis & Co recommended the shareholders of Meta Platforms, Inc to vote for a...","On May 28, 2025, JLens announced that independent proxy advisory firms Institutional Shareholder Services Glass, Lewis & Co recommended the shareholders of Meta Platforms, Inc to vote for a...",0.7903566956520081
Meta Is Working On Plans To Open Physical Stores And Hire Retail Workers- Business Insider,2025-05-28 20:02:07,Finnhub,https://finnhub.io/api/news?id=a710fe88f33de674e1eb1a52adb6758160bd58306e9a85e4b251e4835861a04e,May 28 - * META IS WORKING ON PLANS TO OPEN PHYSICAL STORES AND HIRERETAILWORKERS- BUSINESS INSIDERSource: https://tinyurl.com/bdcnb2y4Further company coverage: ...,May 28 - * META IS WORKING ON PLANS TO OPEN PHYSICAL STORES AND HIRERETAILWORKERS- BUSINESS INSIDERSource: https://tinyurl.com/bdcnb2y4Further company coverage: ...,0.8708598576486111
US to ban foreign officials over 'flagrant censorship' on social media,2025-05-28 19:32:16,Finnhub,https://finnhub.io/api/news?id=7fe205bc349fc52e9aaeb37ace65377b50dfb9748dd0fedc632e7084999e86bf,* Restrictions on visiting US an apparent escalation byWashington * Rubio says arrest warrants for social media posts'unacceptable' * EU...,* Restrictions on visiting US an apparent escalation byWashington * Rubio says arrest warrants for social media posts'unacceptable' * EU...,0.5125523833557963
"Broadcom Stock Is Rising. Shares Can Soar Past Their Record, Says Analyst.",2025-05-28 18:39:00,MarketWatch,https://finnhub.io/api/news?id=a40562b403e9711326a0dd70cf392f1e8df364f4c1faf8455a6462f8c2db2d85,"Broadcom Stock Is Rising. Shares Can Soar Past Their Record, Says Analyst.","Broadcom Stock Is Rising. Shares Can Soar Past Their Record, Says Analyst.",0.05444713309407234
"Telegram, Musk-owned xAI partner to distribute Grok to messaging app's users",2025-05-28 17:07:12,Finnhub,https://finnhub.io/api/news?id=358ec0855e5c26600e01e1ec8d413429bee8db1b188c872f8c487cc4c9038ba7,"Elon Musk's AI start-up xAI will payTelegram $300 million to deploy its Grok chatbot on themessaging app, aiming to tap the platform's more than onebillion users and sharpen its competitive edge in...","Elon Musk's AI start-up xAI will payTelegram $300 million to deploy its Grok chatbot on themessaging app, aiming to tap the platform's more than onebillion users and sharpen its competitive edge in...",0.06604650616645813
Is Meta Platforms' Business in Trouble?,2025-05-28 16:25:00,Yahoo,https://finnhub.io/api/news?id=b745ff3ffd2f557afc48896e42a490d368b73461239304ef5e7ead76248d65dc,"Meta's growth rate slowed down in recent quarters.  Meta Platforms (NASDAQ: META), the social media giant that owns Facebook, Instagram, and WhatsApp, has been a growth beast in recent years.  A recent report from The Wall Street Journal discussed some significant shortcomings in Meta's business, which it says could make Meta vulnerable to regulatory pressures in the future.","Meta's growth rate slowed down in recent quarters.  Meta Platforms (NASDAQ: META), the social media giant that owns Facebook, Instagram, and WhatsApp, has been a growth beast in recent years.  A recent report from The Wall Street Journal discussed some significant shortcomings in Meta's business, which it says could make Meta vulnerable to regulatory pressures in the future.",0.5021038698032498
"Semiconductor Industry Updates: Tariffs Ease, Hyperscalers Double Down, And AI Accelerates",2025-05-28 15:35:00,SeekingAlpha,https://finnhub.io/api/news?id=1091f911d2532aebe68ae1efb8180c85a2017f0f72321c7767d868aba8a7e38b,"The tariff pause offers temporary relief to semiconductors, but structural trade tensions persist.","The tariff pause offers temporary relief to semiconductors, but structural trade tensions persist.",0.15952938236296177
Alphabet's Veo 3: AI Video Crown Achieved,2025-05-28 12:56:06,SeekingAlpha,https://finnhub.io/api/news?id=5dbf4df58a75a6e4b973d641aa1233b07cdf7bb03fa30bc4d2b2a2c1dd527cdb,"VEO 3 is Google's AI video analysis tool, now accessible via the Ultra Plan. YouTube serves as a vast data resource. See more on GOOGL stock here.","VEO 3 is Google's AI video analysis tool, now accessible via the Ultra Plan. YouTube serves as a vast data resource. See more on GOOGL stock here.",0.9340191595256329
Meta’s Future Lies With Judge as FTC Antitrust Trial Ends,2025-05-28 05:09:07,Yahoo,https://finnhub.io/api/news?id=3e9e3d4e50beea6c278be4e3f03a5de7a50d885a3dc1a90e3df70dd5fb8fcdda,"(Bloomberg) -- Meta Platforms Inc. has done all it can in court to fight back at the US Federal Trade Commission’s claims that it’s a monopoly. Now it’s up to a federal judge to decide whether the company should be broken up.Most Read from BloombergUAE’s AI University Aims to Become Stanford of the GulfNY Wins Order Against US Funding Freeze in Congestion FightThe seven-week trial wrapped up Tuesday, and now each side has four months to make its case in writing. Then US District Judge James Boas","(Bloomberg) -- Meta Platforms Inc. has done all it can in court to fight back at the US Federal Trade Commission’s claims that it’s a monopoly. Now it’s up to a federal judge to decide whether the company should be broken up.Most Read from BloombergUAE’s AI University Aims to Become Stanford of the GulfNY Wins Order Against US Funding Freeze in Congestion FightThe seven-week trial wrapped up Tuesday, and now each side has four months to make its case in writing. Then US District Judge James Boas",0.9029624126851559
Nvidia’s suppliers resolve AI rack issues in boost to sales,2025-05-28 04:00:44,Yahoo,https://finnhub.io/api/news?id=263f6aaf165cd7f85e2d395d7e078ffdaeb297d7912416f97866340888e2d272,Nvidia’s suppliers are accelerating production of its flagship AI data centre “racks” following a resolution of technical issues that had delayed...,Nvidia’s suppliers are accelerating production of its flagship AI data centre “racks” following a resolution of technical issues that had delayed...,0.061184351332485676
Meta reportedly splits its AI team to build products faster,2025-05-28 03:12:34,Yahoo,https://finnhub.io/api/news?id=fa20bdc53503282df9720cb789dbcb9d00dd35c4dd7829e79239cdbf5a9c68d5,"Meta is dividing its AI department into two new teams, according to a report from Axios. Now, the company's AI personnel will be assigned to an AI products team, or an AGI Foundations unit. No jobs appear to have been cut. The AI products team will focus on consumer-facing efforts like the AI features within Facebook, Instagram, and WhatsApp, as well as Meta's new standalone AI app. The AGI Foundations unit will focus on more of the bigger picture efforts, like improving its Llama models. As com","Meta is dividing its AI department into two new teams, according to a report from Axios. Now, the company's AI personnel will be assigned to an AI products team, or an AGI Foundations unit. No jobs appear to have been cut. The AI products team will focus on consumer-facing efforts like the AI features within Facebook, Instagram, and WhatsApp, as well as Meta's new standalone AI app. The AGI Foundations unit will focus on more of the bigger picture efforts, like improving its Llama models. As com",0.9192340653389692
Zuckerberg's Bet on MAGA Has Yet to Pay Off for Meta,2025-05-28 01:33:49,Finnhub,https://finnhub.io/api/news?id=33a07373afaab5e886d4ca2d5c5eb0110b2af9084e574b70456e1fa4d0d6dcaa,"Mark Zuckerberg has gotten close with President Trump and the White House, but those ties have yet to bear fruit for his social media company, Meta. Bloomberg's Riley Griffin discusses her latest...","Mark Zuckerberg has gotten close with President Trump and the White House, but those ties have yet to bear fruit for his social media company, Meta. Bloomberg's Riley Griffin discusses her latest...",0.673616349697113
"After 15 years, you can finally use WhatsApp on your iPad: Here’s how to get the app on your Apple tablet",2025-05-28 01:00:00,Yahoo,https://finnhub.io/api/news?id=24a0a87fe9bb94da546cf2f28cfe7c77c9b4d3b751f6366716cfeb865936ad1b,Meta released the iPad-friendly version of the messaging app today with little fanfare.,Meta released the iPad-friendly version of the messaging app today with little fanfare.,0.8720698580145836
Market Chatter: Meta Platforms Reorganizing AI Teams to Speed Up Product Development,2025-05-28 00:51:41,Yahoo,https://finnhub.io/api/news?id=29c7f04ca99b403fee04f1e9d2953a77911b5d341160d272f1b7411c750567b9,Meta Platforms (META) is reorganizing its artificial intelligence teams to speed up product developm,Meta Platforms (META) is reorganizing its artificial intelligence teams to speed up product developm,0.6205634772777557
Trump Vs. Apple: We Know How This One Ends (Rating Upgrade),2025-05-27 21:15:00,SeekingAlpha,https://finnhub.io/api/news?id=f8abca89702576bb917303f8a5b62e29c2818ba35d803f0154688884168825f7,"Apple Inc.'s recent pullback is a buying opportunity. Click to explore AAPL stock's valuation, AI roadmap, and why it shows strong long-term upside.","Apple Inc.'s recent pullback is a buying opportunity. Click to explore AAPL stock's valuation, AI roadmap, and why it shows strong long-term upside.",0.6743786334991455
"Meta Platforms, Inc. (META) Is a Trending Stock: Facts to Know Before Betting on It",2025-05-27 21:00:13,Yahoo,https://finnhub.io/api/news?id=4c2673607e4155e64c3415867f25715e24834759ab6761e7b04bb4a1a213faf8,"Meta Platforms (META) has been one of the stocks most watched by Zacks.com users lately. So, it is worth exploring what lies ahead for the stock.","Meta Platforms (META) has been one of the stocks most watched by Zacks.com users lately. So, it is worth exploring what lies ahead for the stock.",0.9381574261933565
